[
  {
    "charsetinfo": {
      "name": "utf-8"
    }
  },
  {
    "securities": [
      {
        "SECID": "RU000A10DQA8",
        "SHORTNAME": "ОФЗ 33 CNY",
        "SECNAME": "ОФЗ-ПД 12156121V 01/06/33",
        "MATDATE": "2033-06-01",
        "PREVLEGALCLOSEPRICE": 104.2,
        "ACCRUEDINT": 1328.186342,
        "COUPONPERIOD": 184,
        "COUPONPERCENT": 7.0,
        "ISIN": "RU000A10DQA8",
        "REGNUMBER": "12156121V",
        "LOTVALUE": 10000,
        "MINSTEP": 0.001,
        "PREVWAPRICE": 104.258,
        "CURRENCYID": "SUR",
        "FACEVALUE": 10000,
        "ISSUESIZE": 800000,
        "COUPONVALUE": 352.88,
        "NEXTCOUPON": "2026-06-10"
      },
      {
        "SECID": "RU000A10DQB6",
        "SHORTNAME": "ОФЗ 29 CNY",
        "SECNAME": "ОФЗ-ПД 12156120V 28/02/29",
        "MATDATE": "2029-02-28",
        "PREVLEGALCLOSEPRICE": 102.5,
        "ACCRUEDINT": 1138.445436,
        "COUPONPERIOD": 86,
        "COUPONPERCENT": 6.0,
        "ISIN": "RU000A10DQB6",
        "REGNUMBER": "12156120V",
        "LOTVALUE": 10000,
        "MINSTEP": 0.001,
        "PREVWAPRICE": 102.448,
        "CURRENCYID": "SUR",
        "FACEVALUE": 10000,
        "ISSUESIZE": 1200000,
        "COUPONVALUE": 141.37,
        "NEXTCOUPON": "2026-03-04"
      },
      {
        "SECID": "SU26207RMFS9",
        "SHORTNAME": "ОФЗ 26207",
        "SECNAME": "ОФЗ-ПД 26207 03/02/27",
        "MATDATE": "2027-02-03",
        "PREVLEGALCLOSEPRICE": 95.09,
        "ACCRUEDINT": 1.12,
        "COUPONPERIOD": 182,
        "COUPONPERCENT": 8.15,
        "ISIN": "RU000A0JS3W6",
        "REGNUMBER": "26207RMFS",
        "LOTVALUE": 1000,
        "MINSTEP": 0.001,
        "PREVWAPRICE": 94.998,
        "CURRENCYID": "SUR",
        "FACEVALUE": 1000,
        "ISSUESIZE": 370299980,
        "COUPONVALUE": 40.64,
        "NEXTCOUPON": "2026-08-05"
      },
      {
        "SECID": "SU26212RMFS9",
        "SHORTNAME": "ОФЗ 26212",
        "SECNAME": "ОФЗ-ПД 26212 19/01/28",
        "MATDATE": "2028-01-19",
        "PREVLEGALCLOSEPRICE": 88.864,
        "ACCRUEDINT": 3.67,
        "COUPONPERIOD": 182,
        "COUPONPERCENT": 7.05,
        "ISIN": "RU000A0JTK38",
        "REGNUMBER": "26212RMFS",
        "LOTVALUE": 1000,
        "MINSTEP": 0.001,
        "PREVWAPRICE": 88.824,
        "CURRENCYID": "SUR",
        "FACEVALUE": 1000,
        "ISSUESIZE": 356981514,
        "COUPONVALUE": 35.15,
        "NEXTCOUPON": "2026-07-22"
      },
      {
        "SECID": "SU26218RMFS6",
        "SHORTNAME": "ОФЗ 26218",
        "SECNAME": "ОФЗ-ПД 26218 17/09/31",
        "MATDATE": "2031-09-17",
        "PREVLEGALCLOSEPRICE": 78.633,
        "ACCRUEDINT": 32.13,
        "COUPONPERIOD": 182,
        "COUPONPERCENT": 8.5,
        "ISIN": "RU000A0JVW48",
        "REGNUMBER": "26218RMFS",
        "LOTVALUE": 1000,
        "MINSTEP": 0.001,
        "PREVWAPRICE": 78.581,
        "CURRENCYID": "SUR",
        "FACEVALUE": 1000,
        "ISSUESIZE": 347608211,
        "COUPONVALUE": 42.38,
        "NEXTCOUPON": "2026-03-25"
      },
      {
        "SECID": "SU26219RMFS4",
        "SHORTNAME": "ОФЗ 26219",
        "SECNAME": "ОФЗ-ПД 26219 16/09/26",
        "MATDATE": "2026-09-16",
        "PREVLEGALCLOSEPRICE": 96.385,
        "ACCRUEDINT": 30.78,
        "COUPONPERIOD": 182,
        "COUPONPERCENT": 7.75,
        "ISIN": "RU000A0JWM07",
        "REGNUMBER": "26219RMFS",
        "LOTVALUE": 1000,
        "MINSTEP": 0.001,
        "PREVWAPRICE": 96.36,
        "CURRENCYID": "SUR",
        "FACEVALUE": 1000,
        "ISSUESIZE": 362076549,
        "COUPONVALUE": 38.64,
        "NEXTCOUPON": "2026-03-18"
      },
      {
        "SECID": "SU26221RMFS0",
        "SHORTNAME": "ОФЗ 26221",
        "SECNAME": "ОФЗ-ПД 26221 23/03/33",
        "MATDATE": "2033-03-23",
        "PREVLEGALCLOSEPRICE": 70.7,
        "ACCRUEDINT": 27.63,
        "COUPONPERIOD": 182,
        "COUPONPERCENT": 7.7,
        "ISIN": "RU000A0JXFM1",
        "REGNUMBER": "26221RMFS",
        "LOTVALUE": 1000,
        "MINSTEP": 0.001,
        "PREVWAPRICE": 70.709,
        "CURRENCYID": "SUR",
        "FACEVALUE": 1000,
        "ISSUESIZE": 396268629,
        "COUPONVALUE": 38.39,
        "NEXTCOUPON": "2026-04-01"
      },
      {
        "SECID": "SU26224RMFS4",
        "SHORTNAME": "ОФЗ 26224",
        "SECNAME": "ОФЗ-ПД 26224 23/05/29",
        "MATDATE": "2029-05-23",
        "PREVLEGALCLOSEPRICE": 81.71,
        "ACCRUEDINT": 14.18,
        "COUPONPERIOD": 182,
        "COUPONPERCENT": 6.9,
        "ISIN": "RU000A0ZYUA9",
        "REGNUMBER": "26224RMFS",
        "LOTVALUE": 1000,
        "MINSTEP": 0.001,
        "PREVWAPRICE": 81.803,
        "CURRENCYID": "SUR",
        "FACEVALUE": 1000,
        "ISSUESIZE": 446912955,
        "COUPONVALUE": 34.41,
        "NEXTCOUPON": "2026-05-27"
      },
      {
        "SECID": "SU26225RMFS1",
        "SHORTNAME": "ОФЗ 26225",
        "SECNAME": "ОФЗ-ПД 26225 10/05/34",
        "MATDATE": "2034-05-10",
        "PREVLEGALCLOSEPRICE": 66,
        "ACCRUEDINT": 16.29,
        "COUPONPERIOD": 182,
        "COUPONPERCENT": 7.25,
        "ISIN": "RU000A0ZYUB7",
        "REGNUMBER": "26225RMFS",
        "LOTVALUE": 1000,
        "MINSTEP": 0.001,
        "PREVWAPRICE": 66.732,
        "CURRENCYID": "SUR",
        "FACEVALUE": 1000,
        "ISSUESIZE": 497974096,
        "COUPONVALUE": 36.15,
        "NEXTCOUPON": "2026-05-20"
      },
      {
        "SECID": "SU26226RMFS9",
        "SHORTNAME": "ОФЗ 26226",
        "SECNAME": "ОФЗ-ПД 26226 07/10/26",
        "MATDATE": "2026-10-07",
        "PREVLEGALCLOSEPRICE": 96.172,
        "ACCRUEDINT": 27.01,
        "COUPONPERIOD": 182,
        "COUPONPERCENT": 7.95,
        "ISIN": "RU000A0ZZYW2",
        "REGNUMBER": "26226RMFS",
        "LOTVALUE": 1000,
        "MINSTEP": 0.001,
        "PREVWAPRICE": 96.191,
        "CURRENCYID": "SUR",
        "FACEVALUE": 1000,
        "ISSUESIZE": 367210831,
        "COUPONVALUE": 39.64,
        "NEXTCOUPON": "2026-04-08"
      },
      {
        "SECID": "SU26228RMFS5",
        "SHORTNAME": "ОФЗ 26228",
        "SECNAME": "ОФЗ-ПД 26228 10/04/30",
        "MATDATE": "2030-04-10",
        "PREVLEGALCLOSEPRICE": 79.994,
        "ACCRUEDINT": 24.53,
        "COUPONPERIOD": 182,
        "COUPONPERCENT": 7.65,
        "ISIN": "RU000A100A82",
        "REGNUMBER": "26228RMFS",
        "LOTVALUE": 1000,
        "MINSTEP": 0.001,
        "PREVWAPRICE": 80.049,
        "CURRENCYID": "SUR",
        "FACEVALUE": 1000,
        "ISSUESIZE": 592018800,
        "COUPONVALUE": 38.15,
        "NEXTCOUPON": "2026-04-15"
      },
      {
        "SECID": "SU26230RMFS1",
        "SHORTNAME": "ОФЗ 26230",
        "SECNAME": "ОФЗ-ПД 26230 16/03/39",
        "MATDATE": "2039-03-16",
        "PREVLEGALCLOSEPRICE": 61.998,
        "ACCRUEDINT": 27.63,
        "COUPONPERIOD": 182,
        "COUPONPERCENT": 7.7,
        "ISIN": "RU000A100EF5",
        "REGNUMBER": "26230RMFS",
        "LOTVALUE": 1000,
        "MINSTEP": 0.001,
        "PREVWAPRICE": 62.045,
        "CURRENCYID": "SUR",
        "FACEVALUE": 1000,
        "ISSUESIZE": 449489066,
        "COUPONVALUE": 38.39,
        "NEXTCOUPON": "2026-04-01"
      },
      {
        "SECID": "SU26231RMFS9",
        "SHORTNAME": "ОФЗ 26231",
        "SECNAME": "ОФЗ-ПД 26231 20/07/44",
        "MATDATE": "2044-07-20",
        "PREVLEGALCLOSEPRICE": null,
        "ACCRUEDINT": 1.24,
        "COUPONPERIOD": 182,
        "COUPONPERCENT": 0.25,
        "ISIN": "RU000A100MY9",
        "REGNUMBER": "26231RMFS",
        "LOTVALUE": 1000,
        "MINSTEP": 0.001,
        "PREVWAPRICE": null,
        "CURRENCYID": "SUR",
        "FACEVALUE": 1000,
        "ISSUESIZE": 212636000,
        "COUPONVALUE": 1.25,
        "NEXTCOUPON": "2026-02-11"
      },
      {
        "SECID": "SU26232RMFS7",
        "SHORTNAME": "ОФЗ 26232",
        "SECNAME": "ОФЗ-ПД 26232 06/10/27",
        "MATDATE": "2027-10-06",
        "PREVLEGALCLOSEPRICE": 88.782,
        "ACCRUEDINT": 20.39,
        "COUPONPERIOD": 182,
        "COUPONPERCENT": 6.0,
        "ISIN": "RU000A1014N4",
        "REGNUMBER": "26232RMFS",
        "LOTVALUE": 1000,
        "MINSTEP": 0.001,
        "PREVWAPRICE": 88.687,
        "CURRENCYID": "SUR",
        "FACEVALUE": 1000,
        "ISSUESIZE": 447933708,
        "COUPONVALUE": 29.92,
        "NEXTCOUPON": "2026-04-08"
      },
      {
        "SECID": "SU26233RMFS5",
        "SHORTNAME": "ОФЗ 26233",
        "SECNAME": "ОФЗ-ПД 26233 18/07/2035",
        "MATDATE": "2035-07-18",
        "PREVLEGALCLOSEPRICE": 58.25,
        "ACCRUEDINT": 2.01,
        "COUPONPERIOD": 182,
        "COUPONPERCENT": 6.1,
        "ISIN": "RU000A101F94",
        "REGNUMBER": "26233RMFS",
        "LOTVALUE": 1000,
        "MINSTEP": 0.001,
        "PREVWAPRICE": 58.209,
        "CURRENCYID": "SUR",
        "FACEVALUE": 1000,
        "ISSUESIZE": 599487782,
        "COUPONVALUE": 30.42,
        "NEXTCOUPON": "2026-07-29"
      },
      {
        "SECID": "SU26235RMFS0",
        "SHORTNAME": "ОФЗ 26235",
        "SECNAME": "ОФЗ-ПД 26235 12/03/2031",
        "MATDATE": "2031-03-12",
        "PREVLEGALCLOSEPRICE": 70.614,
        "ACCRUEDINT": 23.44,
        "COUPONPERIOD": 182,
        "COUPONPERCENT": 5.9,
        "ISIN": "RU000A1028E3",
        "REGNUMBER": "26235RMFS",
        "LOTVALUE": 1000,
        "MINSTEP": 0.001,
        "PREVWAPRICE": 70.662,
        "CURRENCYID": "SUR",
        "FACEVALUE": 1000,
        "ISSUESIZE": 633816503,
        "COUPONVALUE": 29.42,
        "NEXTCOUPON": "2026-03-18"
      },
      {
        "SECID": "SU26236RMFS8",
        "SHORTNAME": "ОФЗ 26236",
        "SECNAME": "ОФЗ-ПД 26236 17/05/2028",
        "MATDATE": "2028-05-17",
        "PREVLEGALCLOSEPRICE": 84.145,
        "ACCRUEDINT": 12.8,
        "COUPONPERIOD": 182,
        "COUPONPERCENT": 5.7,
        "ISIN": "RU000A102BT8",
        "REGNUMBER": "26236RMFS",
        "LOTVALUE": 1000,
        "MINSTEP": 0.001,
        "PREVWAPRICE": 84.153,
        "CURRENCYID": "SUR",
        "FACEVALUE": 1000,
        "ISSUESIZE": 498594408,
        "COUPONVALUE": 28.42,
        "NEXTCOUPON": "2026-05-20"
      },
      {
        "SECID": "SU26237RMFS6",
        "SHORTNAME": "ОФЗ 26237",
        "SECNAME": "ОФЗ-ПД 26237 14/03/2029",
        "MATDATE": "2029-03-14",
        "PREVLEGALCLOSEPRICE": 82.159,
        "ACCRUEDINT": 26.62,
        "COUPONPERIOD": 182,
        "COUPONPERCENT": 6.7,
        "ISIN": "RU000A1038Z7",
        "REGNUMBER": "26237RMFS",
        "LOTVALUE": 1000,
        "MINSTEP": 0.001,
        "PREVWAPRICE": 82.15,
        "CURRENCYID": "SUR",
        "FACEVALUE": 1000,
        "ISSUESIZE": 418953119,
        "COUPONVALUE": 33.41,
        "NEXTCOUPON": "2026-03-18"
      },
      {
        "SECID": "SU26238RMFS4",
        "SHORTNAME": "ОФЗ 26238",
        "SECNAME": "ОФЗ-ПД 26238 15/05/2041",
        "MATDATE": "2041-05-15",
        "PREVLEGALCLOSEPRICE": 58.28,
        "ACCRUEDINT": 13.23,
        "COUPONPERIOD": 182,
        "COUPONPERCENT": 7.1,
        "ISIN": "RU000A1038V6",
        "REGNUMBER": "26238RMFS",
        "LOTVALUE": 1000,
        "MINSTEP": 0.001,
        "PREVWAPRICE": 58.345,
        "CURRENCYID": "SUR",
        "FACEVALUE": 1000,
        "ISSUESIZE": 750000000,
        "COUPONVALUE": 35.4,
        "NEXTCOUPON": "2026-06-03"
      },
      {
        "SECID": "SU26239RMFS2",
        "SHORTNAME": "ОФЗ 26239",
        "SECNAME": "ОФЗ-ПД 26239 23/07/2031",
        "MATDATE": "2031-07-23",
        "PREVLEGALCLOSEPRICE": 72.747,
        "ACCRUEDINT": 2.27,
        "COUPONPERIOD": 182,
        "COUPONPERCENT": 6.9,
        "ISIN": "RU000A103901",
        "REGNUMBER": "26239RMFS",
        "LOTVALUE": 1000,
        "MINSTEP": 0.001,
        "PREVWAPRICE": 72.768,
        "CURRENCYID": "SUR",
        "FACEVALUE": 1000,
        "ISSUESIZE": 549052350,
        "COUPONVALUE": 34.41,
        "NEXTCOUPON": "2026-07-29"
      },
      {
        "SECID": "SU26240RMFS0",
        "SHORTNAME": "ОФЗ 26240",
        "SECNAME": "ОФЗ-ПД 26240 30/07/2036",
        "MATDATE": "2036-07-30",
        "PREVLEGALCLOSEPRICE": 61.926,
        "ACCRUEDINT": 34.52,
        "COUPONPERIOD": 182,
        "COUPONPERCENT": 7.0,
        "ISIN": "RU000A103BR0",
        "REGNUMBER": "26240RMFS",
        "LOTVALUE": 1000,
        "MINSTEP": 0.001,
        "PREVWAPRICE": 61.97,
        "CURRENCYID": "SUR",
        "FACEVALUE": 1000,
        "ISSUESIZE": 550000000,
        "COUPONVALUE": 34.9,
        "NEXTCOUPON": "2026-02-11"
      },
      {
        "SECID": "SU26241RMFS8",
        "SHORTNAME": "ОФЗ 26241",
        "SECNAME": "ОФЗ-ПД 26241 17/11/32",
        "MATDATE": "2032-11-17",
        "PREVLEGALCLOSEPRICE": 79.092,
        "ACCRUEDINT": 19.52,
        "COUPONPERIOD": 182,
        "COUPONPERCENT": 9.5,
        "ISIN": "RU000A105FZ9",
        "REGNUMBER": "26241RMFS",
        "LOTVALUE": 1000,
        "MINSTEP": 0.001,
        "PREVWAPRICE": 79.098,
        "CURRENCYID": "SUR",
        "FACEVALUE": 1000,
        "ISSUESIZE": 750000000,
        "COUPONVALUE": 47.37,
        "NEXTCOUPON": "2026-05-27"
      },
      {
        "SECID": "SU26242RMFS6",
        "SHORTNAME": "ОФЗ 26242",
        "SECNAME": "ОФЗ-ПД 26242 29/08/29",
        "MATDATE": "2029-08-29",
        "PREVLEGALCLOSEPRICE": 86.002,
        "ACCRUEDINT": 39.21,
        "COUPONPERIOD": 182,
        "COUPONPERCENT": 9.0,
        "ISIN": "RU000A105RV3",
        "REGNUMBER": "26242RMFS",
        "LOTVALUE": 1000,
        "MINSTEP": 0.001,
        "PREVWAPRICE": 86.148,
        "CURRENCYID": "SUR",
        "FACEVALUE": 1000,
        "ISSUESIZE": 529356615,
        "COUPONVALUE": 44.88,
        "NEXTCOUPON": "2026-03-04"
      },
      {
        "SECID": "SU26243RMFS4",
        "SHORTNAME": "ОФЗ 26243",
        "SECNAME": "ОФЗ-ПД 26243 19/05/38",
        "MATDATE": "2038-05-19",
        "PREVLEGALCLOSEPRICE": 73.45,
        "ACCRUEDINT": 18.26,
        "COUPONPERIOD": 182,
        "COUPONPERCENT": 9.8,
        "ISIN": "RU000A106E90",
        "REGNUMBER": "26243RMFS",
        "LOTVALUE": 1000,
        "MINSTEP": 0.001,
        "PREVWAPRICE": 73.527,
        "CURRENCYID": "SUR",
        "FACEVALUE": 1000,
        "ISSUESIZE": 750000000,
        "COUPONVALUE": 48.87,
        "NEXTCOUPON": "2026-06-03"
      },
      {
        "SECID": "SU26244RMFS2",
        "SHORTNAME": "ОФЗ 26244",
        "SECNAME": "ОФЗ-ПД 26244 15/03/34",
        "MATDATE": "2034-03-15",
        "PREVLEGALCLOSEPRICE": 85.045,
        "ACCRUEDINT": 42.54,
        "COUPONPERIOD": 182,
        "COUPONPERCENT": 11.25,
        "ISIN": "RU000A1074G2",
        "REGNUMBER": "26244RMFS",
        "LOTVALUE": 1000,
        "MINSTEP": 0.001,
        "PREVWAPRICE": 85.157,
        "CURRENCYID": "SUR",
        "FACEVALUE": 1000,
        "ISSUESIZE": 750000000,
        "COUPONVALUE": 56.1,
        "NEXTCOUPON": "2026-03-25"
      },
      {
        "SECID": "SU26245RMFS9",
        "SHORTNAME": "ОФЗ 26245",
        "SECNAME": "ОФЗ-ПД 26245 26/09/35",
        "MATDATE": "2035-09-26",
        "PREVLEGALCLOSEPRICE": 87.377,
        "ACCRUEDINT": 40.77,
        "COUPONPERIOD": 182,
        "COUPONPERCENT": 12.0,
        "ISIN": "RU000A108EG6",
        "REGNUMBER": "26245RMFS",
        "LOTVALUE": 1000,
        "MINSTEP": 0.001,
        "PREVWAPRICE": 87.31,
        "CURRENCYID": "SUR",
        "FACEVALUE": 1000,
        "ISSUESIZE": 750000000,
        "COUPONVALUE": 59.84,
        "NEXTCOUPON": "2026-04-08"
      },
      {
        "SECID": "SU26246RMFS7",
        "SHORTNAME": "ОФЗ 26246",
        "SECNAME": "ОФЗ-ПД 26246 12/03/36",
        "MATDATE": "2036-03-12",
        "PREVLEGALCLOSEPRICE": 86.996,
        "ACCRUEDINT": 45.37,
        "COUPONPERIOD": 182,
        "COUPONPERCENT": 12.0,
        "ISIN": "RU000A108EE1",
        "REGNUMBER": "26246RMFS",
        "LOTVALUE": 1000,
        "MINSTEP": 0.001,
        "PREVWAPRICE": 86.951,
        "CURRENCYID": "SUR",
        "FACEVALUE": 1000,
        "ISSUESIZE": 1000000000,
        "COUPONVALUE": 59.84,
        "NEXTCOUPON": "2026-03-25"
      },
      {
        "SECID": "SU26247RMFS5",
        "SHORTNAME": "ОФЗ 26247",
        "SECNAME": "ОФЗ-ПД 26247 11/05/39",
        "MATDATE": "2039-05-11",
        "PREVLEGALCLOSEPRICE": 87.187,
        "ACCRUEDINT": 25.17,
        "COUPONPERIOD": 182,
        "COUPONPERCENT": 12.25,
        "ISIN": "RU000A108EF8",
        "REGNUMBER": "26247RMFS",
        "LOTVALUE": 1000,
        "MINSTEP": 0.001,
        "PREVWAPRICE": 87.121,
        "CURRENCYID": "SUR",
        "FACEVALUE": 1000,
        "ISSUESIZE": 1000000000,
        "COUPONVALUE": 61.08,
        "NEXTCOUPON": "2026-05-27"
      },
      {
        "SECID": "SU26248RMFS3",
        "SHORTNAME": "ОФЗ 26248",
        "SECNAME": "ОФЗ-ПД 26248 16/05/40",
        "MATDATE": "2040-05-16",
        "PREVLEGALCLOSEPRICE": 87.181,
        "ACCRUEDINT": 22.82,
        "COUPONPERIOD": 182,
        "COUPONPERCENT": 12.25,
        "ISIN": "RU000A108EH4",
        "REGNUMBER": "26248RMFS",
        "LOTVALUE": 1000,
        "MINSTEP": 0.001,
        "PREVWAPRICE": 87.143,
        "CURRENCYID": "SUR",
        "FACEVALUE": 1000,
        "ISSUESIZE": 1000000000,
        "COUPONVALUE": 61.08,
        "NEXTCOUPON": "2026-06-03"
      },
      {
        "SECID": "SU26249RMFS1",
        "SHORTNAME": "ОФЗ 26249",
        "SECNAME": "ОФЗ-ПД 26249 16/06/32",
        "MATDATE": "2032-06-16",
        "PREVLEGALCLOSEPRICE": 86,
        "ACCRUEDINT": 14.16,
        "COUPONPERIOD": 182,
        "COUPONPERCENT": 11.0,
        "ISIN": "RU000A10BVC8",
        "REGNUMBER": "26249RMFS",
        "LOTVALUE": 1000,
        "MINSTEP": 0.001,
        "PREVWAPRICE": 85.942,
        "CURRENCYID": "SUR",
        "FACEVALUE": 1000,
        "ISSUESIZE": 500000000,
        "COUPONVALUE": 54.85,
        "NEXTCOUPON": "2026-06-24"
      },
      {
        "SECID": "SU26250RMFS9",
        "SHORTNAME": "ОФЗ 26250",
        "SECNAME": "ОФЗ-ПД 26250 10/06/37",
        "MATDATE": "2037-06-10",
        "PREVLEGALCLOSEPRICE": 86,
        "ACCRUEDINT": 15.45,
        "COUPONPERIOD": 182,
        "COUPONPERCENT": 12.0,
        "ISIN": "RU000A10BVH7",
        "REGNUMBER": "26250RMFS",
        "LOTVALUE": 1000,
        "MINSTEP": 0.001,
        "PREVWAPRICE": 86.045,
        "CURRENCYID": "SUR",
        "FACEVALUE": 1000,
        "ISSUESIZE": 750000000,
        "COUPONVALUE": 59.84,
        "NEXTCOUPON": "2026-06-24"
      },
      {
        "SECID": "SU26251RMFS7",
        "SHORTNAME": "ОФЗ 26251",
        "SECNAME": "ОФЗ-ПД 26251 28/08/2030",
        "MATDATE": "2030-08-28",
        "PREVLEGALCLOSEPRICE": 84.348,
        "ACCRUEDINT": 43.2,
        "COUPONPERIOD": 189,
        "COUPONPERCENT": 9.5,
        "ISIN": "RU000A10CKT3",
        "REGNUMBER": "26251RMFS",
        "LOTVALUE": 1000,
        "MINSTEP": 0.001,
        "PREVWAPRICE": 84.215,
        "CURRENCYID": "SUR",
        "FACEVALUE": 1000,
        "ISSUESIZE": 500000000,
        "COUPONVALUE": 49.19,
        "NEXTCOUPON": "2026-03-04"
      },
      {
        "SECID": "SU26252RMFS5",
        "SHORTNAME": "ОФЗ 26252",
        "SECNAME": "ОФЗ-ПД 26252 12/10/2033",
        "MATDATE": "2033-10-12",
        "PREVLEGALCLOSEPRICE": 91,
        "ACCRUEDINT": 37.67,
        "COUPONPERIOD": 182,
        "COUPONPERCENT": 12.5,
        "ISIN": "RU000A10D4Y2",
        "REGNUMBER": "26252RMFS",
        "LOTVALUE": 1000,
        "MINSTEP": 0.001,
        "PREVWAPRICE": 90.985,
        "CURRENCYID": "SUR",
        "FACEVALUE": 1000,
        "ISSUESIZE": 500000000,
        "COUPONVALUE": 62.33,
        "NEXTCOUPON": "2026-04-22"
      },
      {
        "SECID": "SU26253RMFS3",
        "SHORTNAME": "ОФЗ 26253",
        "SECNAME": "ОФЗ-ПД 26253 06/10/2038",
        "MATDATE": "2038-10-06",
        "PREVLEGALCLOSEPRICE": 91.056,
        "ACCRUEDINT": 39.18,
        "COUPONPERIOD": 182,
        "COUPONPERCENT": 13.0,
        "ISIN": "RU000A10D517",
        "REGNUMBER": "26253RMFS",
        "LOTVALUE": 1000,
        "MINSTEP": 0.001,
        "PREVWAPRICE": 91.046,
        "CURRENCYID": "SUR",
        "FACEVALUE": 1000,
        "ISSUESIZE": 750000000,
        "COUPONVALUE": 64.82,
        "NEXTCOUPON": "2026-04-22"
      },
      {
        "SECID": "SU26254RMFS1",
        "SHORTNAME": "ОФЗ 26254",
        "SECNAME": "ОФЗ-ПД 26254 03/10/2040",
        "MATDATE": "2040-10-03",
        "PREVLEGALCLOSEPRICE": 90.801,
        "ACCRUEDINT": 39.18,
        "COUPONPERIOD": 182,
        "COUPONPERCENT": 13.0,
        "ISIN": "RU000A10D533",
        "REGNUMBER": "26254RMFS",
        "LOTVALUE": 1000,
        "MINSTEP": 0.001,
        "PREVWAPRICE": 90.856,
        "CURRENCYID": "SUR",
        "FACEVALUE": 1000,
        "ISSUESIZE": 1000000000,
        "COUPONVALUE": 64.82,
        "NEXTCOUPON": "2026-04-22"
      },
      {
        "SECID": "SU29007RMFS0",
        "SHORTNAME": "ОФЗ 29007",
        "SECNAME": "ОФЗ-ПК 29007 03/03/27",
        "MATDATE": "2027-03-03",
        "PREVLEGALCLOSEPRICE": 102.45,
        "ACCRUEDINT": 93.05,
        "COUPONPERIOD": 182,
        "COUPONPERCENT": 21.36,
        "ISIN": "RU000A0JV4M0",
        "REGNUMBER": "29007RMFS",
        "LOTVALUE": 1000,
        "MINSTEP": 0.001,
        "PREVWAPRICE": 102.446,
        "CURRENCYID": "SUR",
        "FACEVALUE": 1000,
        "ISSUESIZE": 190287001,
        "COUPONVALUE": 106.51,
        "NEXTCOUPON": "2026-03-04"
      },
      {
        "SECID": "SU29008RMFS8",
        "SHORTNAME": "ОФЗ 29008",
        "SECNAME": "ОФЗ-ПК 29008 03/10/29",
        "MATDATE": "2029-10-03",
        "PREVLEGALCLOSEPRICE": 103.6,
        "ACCRUEDINT": 70.12,
        "COUPONPERIOD": 182,
        "COUPONPERCENT": 20.64,
        "ISIN": "RU000A0JV4P3",
        "REGNUMBER": "29008RMFS",
        "LOTVALUE": 1000,
        "MINSTEP": 0.001,
        "PREVWAPRICE": 103.652,
        "CURRENCYID": "SUR",
        "FACEVALUE": 1000,
        "ISSUESIZE": 190287001,
        "COUPONVALUE": 102.92,
        "NEXTCOUPON": "2026-04-08"
      },
      {
        "SECID": "SU29009RMFS6",
        "SHORTNAME": "ОФЗ 29009",
        "SECNAME": "ОФЗ-ПК 29009 05/05/32",
        "MATDATE": "2032-05-05",
        "PREVLEGALCLOSEPRICE": 104.551,
        "ACCRUEDINT": 48.5,
        "COUPONPERIOD": 182,
        "COUPONPERCENT": 19.89,
        "ISIN": "RU000A0JV4N8",
        "REGNUMBER": "29009RMFS",
        "LOTVALUE": 1000,
        "MINSTEP": 0.001,
        "PREVWAPRICE": 103.981,
        "CURRENCYID": "SUR",
        "FACEVALUE": 1000,
        "ISSUESIZE": 190287001,
        "COUPONVALUE": 99.18,
        "NEXTCOUPON": "2026-05-13"
      },
      {
        "SECID": "SU29010RMFS4",
        "SHORTNAME": "ОФЗ 29010",
        "SECNAME": "ОФЗ-ПК 29010 06/12/34",
        "MATDATE": "2034-12-06",
        "PREVLEGALCLOSEPRICE": 106.082,
        "ACCRUEDINT": 28.32,
        "COUPONPERIOD": 182,
        "COUPONPERCENT": 19.14,
        "ISIN": "RU000A0JV4Q1",
        "REGNUMBER": "29010RMFS",
        "LOTVALUE": 1000,
        "MINSTEP": 0.001,
        "PREVWAPRICE": 106.036,
        "CURRENCYID": "SUR",
        "FACEVALUE": 1000,
        "ISSUESIZE": 190287001,
        "COUPONVALUE": 95.44,
        "NEXTCOUPON": "2026-06-17"
      },
      {
        "SECID": "SU29013RMFS8",
        "SHORTNAME": "ОФЗ 29013",
        "SECNAME": "ОФЗ-ПК 29013 18/09/30",
        "MATDATE": "2030-09-18",
        "PREVLEGALCLOSEPRICE": 97.1,
        "ACCRUEDINT": 20.33,
        "COUPONPERIOD": 91,
        "COUPONPERCENT": null,
        "ISIN": "RU000A101KT1",
        "REGNUMBER": "29013RMFS",
        "LOTVALUE": 1000,
        "MINSTEP": 0.001,
        "PREVWAPRICE": 97.104,
        "CURRENCYID": "SUR",
        "FACEVALUE": 1000,
        "ISSUESIZE": 427467173,
        "COUPONVALUE": 0,
        "NEXTCOUPON": "2026-03-25"
      },
      {
        "SECID": "SU29014RMFS6",
        "SHORTNAME": "ОФЗ 29014",
        "SECNAME": "ОФЗ-ПК 29014 25/03/26",
        "MATDATE": "2026-03-25",
        "PREVLEGALCLOSEPRICE": 99.917,
        "ACCRUEDINT": 20.33,
        "COUPONPERIOD": 91,
        "COUPONPERCENT": null,
        "ISIN": "RU000A101N52",
        "REGNUMBER": "29014RMFS",
        "LOTVALUE": 1000,
        "MINSTEP": 0.001,
        "PREVWAPRICE": 99.899,
        "CURRENCYID": "SUR",
        "FACEVALUE": 1000,
        "ISSUESIZE": 450000000,
        "COUPONVALUE": 0,
        "NEXTCOUPON": "2026-03-25"
      },
      {
        "SECID": "SU29015RMFS3",
        "SHORTNAME": "ОФЗ 29015",
        "SECNAME": "ОФЗ-ПК 29015 18/10/2028",
        "MATDATE": "2028-10-18",
        "PREVLEGALCLOSEPRICE": 98.369,
        "ACCRUEDINT": 8.2,
        "COUPONPERIOD": 91,
        "COUPONPERCENT": null,
        "ISIN": "RU000A1025A7",
        "REGNUMBER": "29015RMFS",
        "LOTVALUE": 1000,
        "MINSTEP": 0.001,
        "PREVWAPRICE": 98.299,
        "CURRENCYID": "SUR",
        "FACEVALUE": 1000,
        "ISSUESIZE": 409796724,
        "COUPONVALUE": 0,
        "NEXTCOUPON": "2026-04-22"
      },
      {
        "SECID": "SU29016RMFS1",
        "SHORTNAME": "ОФЗ 29016",
        "SECNAME": "ОФЗ-ПК 29016 23/12/2026",
        "MATDATE": "2026-12-23",
        "PREVLEGALCLOSEPRICE": 99.7,
        "ACCRUEDINT": 20.33,
        "COUPONPERIOD": 91,
        "COUPONPERCENT": null,
        "ISIN": "RU000A1025B5",
        "REGNUMBER": "29016RMFS",
        "LOTVALUE": 1000,
        "MINSTEP": 0.001,
        "PREVWAPRICE": 99.714,
        "CURRENCYID": "SUR",
        "FACEVALUE": 1000,
        "ISSUESIZE": 155059582,
        "COUPONVALUE": 0,
        "NEXTCOUPON": "2026-03-25"
      },
      {
        "SECID": "SU29017RMFS9",
        "SHORTNAME": "ОФЗ 29017",
        "SECNAME": "ОФЗ-ПК 29017 25/08/2032",
        "MATDATE": "2032-08-25",
        "PREVLEGALCLOSEPRICE": 96.92,
        "ACCRUEDINT": 29.64,
        "COUPONPERIOD": 91,
        "COUPONPERCENT": null,
        "ISIN": "RU000A1028D5",
        "REGNUMBER": "29017RMFS",
        "LOTVALUE": 1000,
        "MINSTEP": 0.001,
        "PREVWAPRICE": 97.003,
        "CURRENCYID": "SUR",
        "FACEVALUE": 1000,
        "ISSUESIZE": 350607135,
        "COUPONVALUE": 0,
        "NEXTCOUPON": "2026-03-04"
      },
      {
        "SECID": "SU29018RMFS7",
        "SHORTNAME": "ОФЗ 29018",
        "SECNAME": "ОФЗ-ПК 29018 26/11/2031",
        "MATDATE": "2031-11-26",
        "PREVLEGALCLOSEPRICE": 97.04,
        "ACCRUEDINT": 29.64,
        "COUPONPERIOD": 91,
        "COUPONPERCENT": null,
        "ISIN": "RU000A102A31",
        "REGNUMBER": "29018RMFS",
        "LOTVALUE": 1000,
        "MINSTEP": 0.001,
        "PREVWAPRICE": 97.153,
        "CURRENCYID": "SUR",
        "FACEVALUE": 1000,
        "ISSUESIZE": 427747115,
        "COUPONVALUE": 0,
        "NEXTCOUPON": "2026-03-04"
      },
      {
        "SECID": "SU29019RMFS5",
        "SHORTNAME": "ОФЗ 29019",
        "SECNAME": "ОФЗ-ПК 29019 18/07/2029",
        "MATDATE": "2029-07-18",
        "PREVLEGALCLOSEPRICE": 98.074,
        "ACCRUEDINT": 8.2,
        "COUPONPERIOD": 91,
        "COUPONPERCENT": null,
        "ISIN": "RU000A102A49",
        "REGNUMBER": "29019RMFS",
        "LOTVALUE": 1000,
        "MINSTEP": 0.001,
        "PREVWAPRICE": 98.222,
        "CURRENCYID": "SUR",
        "FACEVALUE": 1000,
        "ISSUESIZE": 430194756,
        "COUPONVALUE": 0,
        "NEXTCOUPON": "2026-04-22"
      },
      {
        "SECID": "SU29020RMFS3",
        "SHORTNAME": "ОФЗ 29020",
        "SECNAME": "ОФЗ-ПК 29020 22/09/2027",
        "MATDATE": "2027-09-22",
        "PREVLEGALCLOSEPRICE": 99.202,
        "ACCRUEDINT": 20.33,
        "COUPONPERIOD": 91,
        "COUPONPERCENT": null,
        "ISIN": "RU000A102BV4",
        "REGNUMBER": "29020RMFS",
        "LOTVALUE": 1000,
        "MINSTEP": 0.001,
        "PREVWAPRICE": 99.212,
        "CURRENCYID": "SUR",
        "FACEVALUE": 1000,
        "ISSUESIZE": 294544699,
        "COUPONVALUE": 0,
        "NEXTCOUPON": "2026-03-25"
      },
      {
        "SECID": "SU29021RMFS1",
        "SHORTNAME": "ОФЗ 29021",
        "SECNAME": "ОФЗ-ПК 29021 27/11/30",
        "MATDATE": "2030-11-27",
        "PREVLEGALCLOSEPRICE": 97.35,
        "ACCRUEDINT": 29.64,
        "COUPONPERIOD": 91,
        "COUPONPERCENT": null,
        "ISIN": "RU000A105B11",
        "REGNUMBER": "29021RMFS",
        "LOTVALUE": 1000,
        "MINSTEP": 0.001,
        "PREVWAPRICE": 97.387,
        "CURRENCYID": "SUR",
        "FACEVALUE": 1000,
        "ISSUESIZE": 500000000,
        "COUPONVALUE": 0,
        "NEXTCOUPON": "2026-03-04"
      },
      {
        "SECID": "SU29022RMFS9",
        "SHORTNAME": "ОФЗ 29022",
        "SECNAME": "ОФЗ-ПК 29022 20/07/33",
        "MATDATE": "2033-07-20",
        "PREVLEGALCLOSEPRICE": 97,
        "ACCRUEDINT": 5.17,
        "COUPONPERIOD": 91,
        "COUPONPERCENT": null,
        "ISIN": "RU000A105G16",
        "REGNUMBER": "29022RMFS",
        "LOTVALUE": 1000,
        "MINSTEP": 0.001,
        "PREVWAPRICE": 97.11,
        "CURRENCYID": "SUR",
        "FACEVALUE": 1000,
        "ISSUESIZE": 1000000000,
        "COUPONVALUE": 0,
        "NEXTCOUPON": "2026-04-29"
      },
      {
        "SECID": "SU29023RMFS7",
        "SHORTNAME": "ОФЗ 29023",
        "SECNAME": "ОФЗ-ПК 29023 23/08/34",
        "MATDATE": "2034-08-23",
        "PREVLEGALCLOSEPRICE": 96.931,
        "ACCRUEDINT": 29.64,
        "COUPONPERIOD": 91,
        "COUPONPERCENT": null,
        "ISIN": "RU000A105L19",
        "REGNUMBER": "29023RMFS",
        "LOTVALUE": 1000,
        "MINSTEP": 0.001,
        "PREVWAPRICE": 97.039,
        "CURRENCYID": "SUR",
        "FACEVALUE": 1000,
        "ISSUESIZE": 1000000000,
        "COUPONVALUE": 0,
        "NEXTCOUPON": "2026-03-04"
      },
      {
        "SECID": "SU29024RMFS5",
        "SHORTNAME": "ОФЗ 29024",
        "SECNAME": "ОФЗ-ПК 29024 18/04/35",
        "MATDATE": "2035-04-18",
        "PREVLEGALCLOSEPRICE": 95.992,
        "ACCRUEDINT": 5.17,
        "COUPONPERIOD": 91,
        "COUPONPERCENT": null,
        "ISIN": "RU000A1066D5",
        "REGNUMBER": "29024RMFS",
        "LOTVALUE": 1000,
        "MINSTEP": 0.001,
        "PREVWAPRICE": 95.91,
        "CURRENCYID": "SUR",
        "FACEVALUE": 1000,
        "ISSUESIZE": 743804137,
        "COUPONVALUE": 0,
        "NEXTCOUPON": "2026-04-29"
      },
      {
        "SECID": "SU29025RMFS2",
        "SHORTNAME": "ОФЗ 29025",
        "SECNAME": "ОФЗ-ПК 29025 12/08/37",
        "MATDATE": "2037-08-12",
        "PREVLEGALCLOSEPRICE": 95.15,
        "ACCRUEDINT": 32.75,
        "COUPONPERIOD": 91,
        "COUPONPERCENT": null,
        "ISIN": "RU000A106Z61",
        "REGNUMBER": "29025RMFS",
        "LOTVALUE": 1000,
        "MINSTEP": 0.001,
        "PREVWAPRICE": 95.209,
        "CURRENCYID": "SUR",
        "FACEVALUE": 1000,
        "ISSUESIZE": 655460338,
        "COUPONVALUE": 0,
        "NEXTCOUPON": "2026-02-25"
      },
      {
        "SECID": "SU29026RMFS0",
        "SHORTNAME": "ОФЗ 29026",
        "SECNAME": "ОФЗ-ПК 29026 04/09/38",
        "MATDATE": "2038-09-04",
        "PREVLEGALCLOSEPRICE": 96,
        "ACCRUEDINT": 29.61,
        "COUPONPERIOD": 90,
        "COUPONPERCENT": null,
        "ISIN": "RU000A10A7D2",
        "REGNUMBER": "29026RMFS",
        "LOTVALUE": 1000,
        "MINSTEP": 0.001,
        "PREVWAPRICE": 96.037,
        "CURRENCYID": "SUR",
        "FACEVALUE": 1000,
        "ISSUESIZE": 1000000000,
        "COUPONVALUE": 0,
        "NEXTCOUPON": "2026-03-04"
      },
      {
        "SECID": "SU29027RMFS8",
        "SHORTNAME": "ОФЗ 29027",
        "SECNAME": "ОФЗ-ПК 29027 11/09/36",
        "MATDATE": "2036-09-11",
        "PREVLEGALCLOSEPRICE": 95.91,
        "ACCRUEDINT": 26.41,
        "COUPONPERIOD": 90,
        "COUPONPERCENT": null,
        "ISIN": "RU000A10AA93",
        "REGNUMBER": "29027RMFS",
        "LOTVALUE": 1000,
        "MINSTEP": 0.001,
        "PREVWAPRICE": 95.938,
        "CURRENCYID": "SUR",
        "FACEVALUE": 1000,
        "ISSUESIZE": 1000000000,
        "COUPONVALUE": 0,
        "NEXTCOUPON": "2026-03-11"
      },
      {
        "SECID": "SU29028RMFS6",
        "SHORTNAME": "ОФЗ 29028",
        "SECNAME": "ОФЗ-ПК 29028 22/10/2039",
        "MATDATE": "2039-10-22",
        "PREVLEGALCLOSEPRICE": 94.89,
        "ACCRUEDINT": 7.8,
        "COUPONPERIOD": 90,
        "COUPONPERCENT": null,
        "ISIN": "RU000A10D4Z9",
        "REGNUMBER": "29028RMFS",
        "LOTVALUE": 1000,
        "MINSTEP": 0.001,
        "PREVWAPRICE": 94.93,
        "CURRENCYID": "SUR",
        "FACEVALUE": 1000,
        "ISSUESIZE": 1000000000,
        "COUPONVALUE": 0,
        "NEXTCOUPON": "2026-04-22"
      },
      {
        "SECID": "SU29029RMFS4",
        "SHORTNAME": "ОФЗ 29029",
        "SECNAME": "ОФЗ-ПК 29029 22/10/2041",
        "MATDATE": "2041-10-22",
        "PREVLEGALCLOSEPRICE": 94.601,
        "ACCRUEDINT": 7.8,
        "COUPONPERIOD": 90,
        "COUPONPERCENT": null,
        "ISIN": "RU000A10D525",
        "REGNUMBER": "29029RMFS",
        "LOTVALUE": 1000,
        "MINSTEP": 0.001,
        "PREVWAPRICE": 94.643,
        "CURRENCYID": "SUR",
        "FACEVALUE": 1000,
        "ISSUESIZE": 1000000000,
        "COUPONVALUE": 0,
        "NEXTCOUPON": "2026-04-22"
      },
      {
        "SECID": "SU46012RMFS9",
        "SHORTNAME": "ОФЗ 46012",
        "SECNAME": "ОФЗ-АД 46012 05/09/29",
        "MATDATE": "2029-09-05",
        "PREVLEGALCLOSEPRICE": 102.75,
        "ACCRUEDINT": 30.35,
        "COUPONPERIOD": 364,
        "COUPONPERCENT": 7.673,
        "ISIN": "RU0002868001",
        "REGNUMBER": "46012RMFS",
        "LOTVALUE": 950,
        "MINSTEP": 0.001,
        "PREVWAPRICE": 103.06,
        "CURRENCYID": "SUR",
        "FACEVALUE": 950,
        "ISSUESIZE": 11189,
        "COUPONVALUE": 72.69,
        "NEXTCOUPON": "2026-09-09"
      },
      {
        "SECID": "SU46020RMFS2",
        "SHORTNAME": "ОФЗ 46020",
        "SECNAME": "ОФЗ-АД 46020 06/02/36",
        "MATDATE": "2036-02-06",
        "PREVLEGALCLOSEPRICE": 70.872,
        "ACCRUEDINT": 34.03,
        "COUPONPERIOD": 182,
        "COUPONPERCENT": 6.9,
        "ISIN": "RU000A0GN9A7",
        "REGNUMBER": "46020RMFS",
        "LOTVALUE": 1000,
        "MINSTEP": 0.001,
        "PREVWAPRICE": 70.902,
        "CURRENCYID": "SUR",
        "FACEVALUE": 1000,
        "ISSUESIZE": 52299927,
        "COUPONVALUE": 34.41,
        "NEXTCOUPON": "2026-02-11"
      },
      {
        "SECID": "SU46023RMFS6",
        "SHORTNAME": "ОФЗ 46023",
        "SECNAME": "ОФЗ-АД 46023 23/07/26",
        "MATDATE": "2026-07-23",
        "PREVLEGALCLOSEPRICE": 99.115,
        "ACCRUEDINT": 0.4,
        "COUPONPERIOD": 182,
        "COUPONPERCENT": 8.16,
        "ISIN": "RU000A0JRTL6",
        "REGNUMBER": "46023RMFS",
        "LOTVALUE": 100,
        "MINSTEP": 0.001,
        "PREVWAPRICE": 98.98,
        "CURRENCYID": "SUR",
        "FACEVALUE": 100,
        "ISSUESIZE": 295000000,
        "COUPONVALUE": 4.07,
        "NEXTCOUPON": "2026-07-23"
      },
      {
        "SECID": "SU52002RMFS1",
        "SHORTNAME": "ОФЗ 52002",
        "SECNAME": "ОФЗ-ИН 52002 02/02/28",
        "MATDATE": "2028-02-02",
        "PREVLEGALCLOSEPRICE": 87.193,
        "ACCRUEDINT": 0.58,
        "COUPONPERIOD": 182,
        "COUPONPERCENT": 2.5,
        "ISIN": "RU000A0ZYZ26",
        "REGNUMBER": "52002RMFS",
        "LOTVALUE": 1689.96,
        "MINSTEP": 0.001,
        "PREVWAPRICE": 87.176,
        "CURRENCYID": "SUR",
        "FACEVALUE": 1689.96,
        "ISSUESIZE": 250000000,
        "COUPONVALUE": 21.14,
        "NEXTCOUPON": "2026-08-05"
      },
      {
        "SECID": "SU52003RMFS9",
        "SHORTNAME": "ОФЗ 52003",
        "SECNAME": "ОФЗ-ИН 52003",
        "MATDATE": "2030-07-17",
        "PREVLEGALCLOSEPRICE": 78.731,
        "ACCRUEDINT": 2,
        "COUPONPERIOD": 182,
        "COUPONPERCENT": 2.5,
        "ISIN": "RU000A102069",
        "REGNUMBER": "52003RMFS",
        "LOTVALUE": 1536.49,
        "MINSTEP": 0.001,
        "PREVWAPRICE": 78.729,
        "CURRENCYID": "SUR",
        "FACEVALUE": 1536.49,
        "ISSUESIZE": 218186911,
        "COUPONVALUE": 19.22,
        "NEXTCOUPON": "2026-07-22"
      },
      {
        "SECID": "SU52004RMFS7",
        "SHORTNAME": "ОФЗ 52004",
        "SECNAME": "ОФЗ-ИН 52004 17/03/32",
        "MATDATE": "2032-03-17",
        "PREVLEGALCLOSEPRICE": 73.41,
        "ACCRUEDINT": 13.66,
        "COUPONPERIOD": 182,
        "COUPONPERCENT": 2.5,
        "ISIN": "RU000A103MX5",
        "REGNUMBER": "52004RMFS",
        "LOTVALUE": 1444.5,
        "MINSTEP": 0.001,
        "PREVWAPRICE": 73.316,
        "CURRENCYID": "SUR",
        "FACEVALUE": 1444.5,
        "ISSUESIZE": 250000000,
        "COUPONVALUE": 18.07,
        "NEXTCOUPON": "2026-03-25"
      },
      {
        "SECID": "SU52005RMFS4",
        "SHORTNAME": "ОФЗ 52005",
        "SECNAME": "ОФЗ-ИН 52005 11/05/33",
        "MATDATE": "2033-05-11",
        "PREVLEGALCLOSEPRICE": 71.798,
        "ACCRUEDINT": 6.96,
        "COUPONPERIOD": 182,
        "COUPONPERCENT": 2.5,
        "ISIN": "RU000A105XV1",
        "REGNUMBER": "52005RMFS",
        "LOTVALUE": 1239.21,
        "MINSTEP": 0.001,
        "PREVWAPRICE": 71.774,
        "CURRENCYID": "SUR",
        "FACEVALUE": 1239.21,
        "ISSUESIZE": 220696983,
        "COUPONVALUE": 15.5,
        "NEXTCOUPON": "2026-05-20"
      }
    ],
    "marketdata": [
      {
        "SECID": "RU000A10DQA8",
        "BID": 103.948,
        "BIDDEPTH": null,
        "OFFER": 104.2,
        "OFFERDEPTH": null,
        "SPREAD": 0.252,
        "BIDDEPTHT": 244,
        "OFFERDEPTHT": 967,
        "OPEN": 104.993,
        "LOW": 103.831,
        "HIGH": 106.165,
        "LAST": 104.2,
        "LASTCHANGE": 0.271,
        "LASTCHANGEPRCNT": 0.26,
        "QTY": 1,
        "VALUE": 114548.1,
        "YIELD": 6.37,
        "VALUE_USD": 1496.34,
        "WAPRICE": 103.854,
        "LASTCNGTOLASTWAPRICE": -0.058,
        "WAPTOPREVWAPRICEPRCNT": -0.39,
        "WAPTOPREVWAPRICE": -0.404,
        "YIELDATWAPRICE": 6.43,
        "YIELDTOPREVYIELD": 0.07,
        "CLOSEYIELD": 0,
        "CLOSEPRICE": null,
        "MARKETPRICETODAY": 103.593,
        "MARKETPRICE": 104.26,
        "LASTTOPREVPRICE": 0.12,
        "NUMTRADES": 142,
        "VOLTODAY": 592,
        "VALTODAY": 67908891,
        "VALTODAY_USD": 887091,
        "BOARDID": "TQOB",
        "TRADINGSTATUS": "T",
        "UPDATETIME": "21:52:33",
        "DURATION": 2122,
        "NUMBIDS": null,
        "NUMOFFERS": null,
        "CHANGE": 0.129,
        "TIME": "21:27:58",
        "HIGHBID": null,
        "LOWOFFER": null,
        "PRICEMINUSPREVWAPRICE": -0.058,
        "LASTBID": null,
        "LASTOFFER": null,
        "LCURRENTPRICE": 104.2,
        "LCLOSEPRICE": 102.65,
        "MARKETPRICE2": 103.593,
        "OPENPERIODPRICE": null,
        "SEQNUM": 20260206220734,
        "SYSTIME": "2026-02-06 22:07:34",
        "VALTODAY_RUR": 67908891,
        "IRICPICLOSE": null,
        "BEICLOSE": null,
        "CBRCLOSE": null,
        "YIELDTOOFFER": null,
        "YIELDLASTCOUPON": null,
        "TRADINGSESSION": "2",
        "CALLOPTIONYIELD": null,
        "CALLOPTIONDURATION": null,
        "ZSPREAD": null,
        "ZSPREADATWAPRICE": null
      },
      {
        "SECID": "RU000A10DQB6",
        "BID": 102.701,
        "BIDDEPTH": null,
        "OFFER": 103.43,
        "OFFERDEPTH": null,
        "SPREAD": 0.729,
        "BIDDEPTHT": 191,
        "OFFERDEPTHT": 264,
        "OPEN": 103.7,
        "LOW": 101.766,
        "HIGH": 104.582,
        "LAST": 103.432,
        "LASTCHANGE": -0.012,
        "LASTCHANGEPRCNT": -0.01,
        "QTY": 2,
        "VALUE": 227407.66,
        "YIELD": 4.84,
        "VALUE_USD": 2970.62,
        "WAPRICE": 101.811,
        "LASTCNGTOLASTWAPRICE": 0.984,
        "WAPTOPREVWAPRICEPRCNT": -0.62,
        "WAPTOPREVWAPRICE": -0.637,
        "YIELDATWAPRICE": 5.42,
        "YIELDTOPREVYIELD": 0.23,
        "CLOSEYIELD": 0,
        "CLOSEPRICE": null,
        "MARKETPRICETODAY": 101.81,
        "MARKETPRICE": 102.448,
        "LASTTOPREVPRICE": 0.98,
        "NUMTRADES": 61,
        "VOLTODAY": 351,
        "VALTODAY": 39812235,
        "VALTODAY_USD": 520066,
        "BOARDID": "TQOB",
        "TRADINGSTATUS": "T",
        "UPDATETIME": "21:52:27",
        "DURATION": 1026,
        "NUMBIDS": null,
        "NUMOFFERS": null,
        "CHANGE": 1.003,
        "TIME": "20:58:33",
        "HIGHBID": null,
        "LOWOFFER": null,
        "PRICEMINUSPREVWAPRICE": 0.984,
        "LASTBID": null,
        "LASTOFFER": null,
        "LCURRENTPRICE": 103.436,
        "LCLOSEPRICE": 101.966,
        "MARKETPRICE2": 101.81,
        "OPENPERIODPRICE": null,
        "SEQNUM": 20260206220728,
        "SYSTIME": "2026-02-06 22:07:28",
        "VALTODAY_RUR": 39812235,
        "IRICPICLOSE": null,
        "BEICLOSE": null,
        "CBRCLOSE": null,
        "YIELDTOOFFER": null,
        "YIELDLASTCOUPON": null,
        "TRADINGSESSION": "2",
        "CALLOPTIONYIELD": null,
        "CALLOPTIONDURATION": null,
        "ZSPREAD": null,
        "ZSPREADATWAPRICE": null
      },
      {
        "SECID": "SU26207RMFS9",
        "BID": 94.952,
        "BIDDEPTH": null,
        "OFFER": 94.967,
        "OFFERDEPTH": null,
        "SPREAD": 0.015,
        "BIDDEPTHT": 48671,
        "OFFERDEPTHT": 67449,
        "OPEN": 95.05,
        "LOW": 94.82,
        "HIGH": 95.05,
        "LAST": 94.952,
        "LASTCHANGE": 0.044,
        "LASTCHANGEPRCNT": 0.05,
        "QTY": 1,
        "VALUE": 949.52,
        "YIELD": 14.29,
        "VALUE_USD": 12.4,
        "WAPRICE": 94.901,
        "LASTCNGTOLASTWAPRICE": -0.046,
        "WAPTOPREVWAPRICEPRCNT": -0.1,
        "WAPTOPREVWAPRICE": -0.097,
        "YIELDATWAPRICE": 14.35,
        "YIELDTOPREVYIELD": 0.17,
        "CLOSEYIELD": 0,
        "CLOSEPRICE": null,
        "MARKETPRICETODAY": 94.898,
        "MARKETPRICE": 95.009,
        "LASTTOPREVPRICE": -0.07,
        "NUMTRADES": 1818,
        "VOLTODAY": 83328,
        "VALTODAY": 79079101,
        "VALTODAY_USD": 1033008,
        "BOARDID": "TQOB",
        "TRADINGSTATUS": "T",
        "UPDATETIME": "21:54:01",
        "DURATION": 352,
        "NUMBIDS": null,
        "NUMOFFERS": null,
        "CHANGE": -0.065,
        "TIME": "21:53:23",
        "HIGHBID": null,
        "LOWOFFER": null,
        "PRICEMINUSPREVWAPRICE": -0.046,
        "LASTBID": null,
        "LASTOFFER": null,
        "LCURRENTPRICE": 94.932,
        "LCLOSEPRICE": 95.047,
        "MARKETPRICE2": 94.898,
        "OPENPERIODPRICE": null,
        "SEQNUM": 20260206220902,
        "SYSTIME": "2026-02-06 22:09:02",
        "VALTODAY_RUR": 79079101,
        "IRICPICLOSE": null,
        "BEICLOSE": null,
        "CBRCLOSE": null,
        "YIELDTOOFFER": null,
        "YIELDLASTCOUPON": null,
        "TRADINGSESSION": "2",
        "CALLOPTIONYIELD": null,
        "CALLOPTIONDURATION": null,
        "ZSPREAD": -0.59,
        "ZSPREADATWAPRICE": -0.53
      },
      {
        "SECID": "SU26212RMFS9",
        "BID": 88.811,
        "BIDDEPTH": null,
        "OFFER": 88.937,
        "OFFERDEPTH": null,
        "SPREAD": 0.126,
        "BIDDEPTHT": 52994,
        "OFFERDEPTHT": 50378,
        "OPEN": 88.864,
        "LOW": 88.713,
        "HIGH": 89,
        "LAST": 88.95,
        "LASTCHANGE": 0.127,
        "LASTCHANGEPRCNT": 0.14,
        "QTY": 38,
        "VALUE": 33801.0,
        "YIELD": 14.19,
        "VALUE_USD": 441.54,
        "WAPRICE": 88.856,
        "LASTCNGTOLASTWAPRICE": 0.126,
        "WAPTOPREVWAPRICEPRCNT": 0.04,
        "WAPTOPREVWAPRICE": 0.032,
        "YIELDATWAPRICE": 14.25,
        "YIELDTOPREVYIELD": 0,
        "CLOSEYIELD": 0,
        "CLOSEPRICE": null,
        "MARKETPRICETODAY": 88.862,
        "MARKETPRICE": 88.822,
        "LASTTOPREVPRICE": 0.11,
        "NUMTRADES": 960,
        "VOLTODAY": 14491,
        "VALTODAY": 12876064,
        "VALTODAY_USD": 168200,
        "BOARDID": "TQOB",
        "TRADINGSTATUS": "T",
        "UPDATETIME": "21:54:01",
        "DURATION": 670,
        "NUMBIDS": null,
        "NUMOFFERS": null,
        "CHANGE": 0.094,
        "TIME": "21:53:50",
        "HIGHBID": null,
        "LOWOFFER": null,
        "PRICEMINUSPREVWAPRICE": 0.126,
        "LASTBID": null,
        "LASTOFFER": null,
        "LCURRENTPRICE": 88.879,
        "LCLOSEPRICE": 88.8,
        "MARKETPRICE2": 88.862,
        "OPENPERIODPRICE": null,
        "SEQNUM": 20260206220902,
        "SYSTIME": "2026-02-06 22:09:02",
        "VALTODAY_RUR": 12876064,
        "IRICPICLOSE": null,
        "BEICLOSE": null,
        "CBRCLOSE": null,
        "YIELDTOOFFER": null,
        "YIELDLASTCOUPON": null,
        "TRADINGSESSION": "2",
        "CALLOPTIONYIELD": null,
        "CALLOPTIONDURATION": null,
        "ZSPREAD": -0.05,
        "ZSPREADATWAPRICE": 0.02
      },
      {
        "SECID": "SU26218RMFS6",
        "BID": 78.057,
        "BIDDEPTH": null,
        "OFFER": 78.077,
        "OFFERDEPTH": null,
        "SPREAD": 0.02,
        "BIDDEPTHT": 9475,
        "OFFERDEPTHT": 7941,
        "OPEN": 78.798,
        "LOW": 78.003,
        "HIGH": 78.95,
        "LAST": 78.057,
        "LASTCHANGE": -0.021,
        "LASTCHANGEPRCNT": -0.03,
        "QTY": 1,
        "VALUE": 780.57,
        "YIELD": 14.83,
        "VALUE_USD": 10.2,
        "WAPRICE": 78.377,
        "LASTCNGTOLASTWAPRICE": -0.524,
        "WAPTOPREVWAPRICEPRCNT": -0.26,
        "WAPTOPREVWAPRICE": -0.204,
        "YIELDATWAPRICE": 14.72,
        "YIELDTOPREVYIELD": 0.07,
        "CLOSEYIELD": 0,
        "CLOSEPRICE": null,
        "MARKETPRICETODAY": 78.375,
        "MARKETPRICE": 78.578,
        "LASTTOPREVPRICE": -0.71,
        "NUMTRADES": 1375,
        "VOLTODAY": 19456,
        "VALTODAY": 15249006,
        "VALTODAY_USD": 199197,
        "BOARDID": "TQOB",
        "TRADINGSTATUS": "T",
        "UPDATETIME": "21:54:01",
        "DURATION": 1550,
        "NUMBIDS": null,
        "NUMOFFERS": null,
        "CHANGE": -0.561,
        "TIME": "21:53:01",
        "HIGHBID": null,
        "LOWOFFER": null,
        "PRICEMINUSPREVWAPRICE": -0.524,
        "LASTBID": null,
        "LASTOFFER": null,
        "LCURRENTPRICE": 78.068,
        "LCLOSEPRICE": 78.09,
        "MARKETPRICE2": 78.375,
        "OPENPERIODPRICE": null,
        "SEQNUM": 20260206220903,
        "SYSTIME": "2026-02-06 22:09:03",
        "VALTODAY_RUR": 15249006,
        "IRICPICLOSE": null,
        "BEICLOSE": null,
        "CBRCLOSE": null,
        "YIELDTOOFFER": null,
        "YIELDLASTCOUPON": null,
        "TRADINGSESSION": "2",
        "CALLOPTIONYIELD": null,
        "CALLOPTIONDURATION": null,
        "ZSPREAD": 0.57,
        "ZSPREADATWAPRICE": 0.46
      },
      {
        "SECID": "SU26219RMFS4",
        "BID": 96.429,
        "BIDDEPTH": null,
        "OFFER": 96.43,
        "OFFERDEPTH": null,
        "SPREAD": 0.001,
        "BIDDEPTHT": 558099,
        "OFFERDEPTHT": 96911,
        "OPEN": 96.385,
        "LOW": 96.299,
        "HIGH": 96.5,
        "LAST": 96.43,
        "LASTCHANGE": 0.001,
        "LASTCHANGEPRCNT": 0,
        "QTY": 2,
        "VALUE": 1928.6,
        "YIELD": 14.62,
        "VALUE_USD": 25.19,
        "WAPRICE": 96.382,
        "LASTCNGTOLASTWAPRICE": 0.07,
        "WAPTOPREVWAPRICEPRCNT": 0.02,
        "WAPTOPREVWAPRICE": 0.022,
        "YIELDATWAPRICE": 14.72,
        "YIELDTOPREVYIELD": 0.05,
        "CLOSEYIELD": 0,
        "CLOSEPRICE": null,
        "MARKETPRICETODAY": 96.385,
        "MARKETPRICE": 96.356,
        "LASTTOPREVPRICE": 0.04,
        "NUMTRADES": 929,
        "VOLTODAY": 41019,
        "VALTODAY": 39535096,
        "VALTODAY_USD": 516446,
        "BOARDID": "TQOB",
        "TRADINGSTATUS": "T",
        "UPDATETIME": "21:54:03",
        "DURATION": 212,
        "NUMBIDS": null,
        "NUMOFFERS": null,
        "CHANGE": 0.035,
        "TIME": "21:53:45",
        "HIGHBID": null,
        "LOWOFFER": null,
        "PRICEMINUSPREVWAPRICE": 0.07,
        "LASTBID": null,
        "LASTOFFER": null,
        "LCURRENTPRICE": 96.43,
        "LCLOSEPRICE": 96.47,
        "MARKETPRICE2": 96.385,
        "OPENPERIODPRICE": 96.385,
        "SEQNUM": 20260206220904,
        "SYSTIME": "2026-02-06 22:09:04",
        "VALTODAY_RUR": 39535096,
        "IRICPICLOSE": null,
        "BEICLOSE": null,
        "CBRCLOSE": null,
        "YIELDTOOFFER": null,
        "YIELDLASTCOUPON": null,
        "TRADINGSESSION": "2",
        "CALLOPTIONYIELD": null,
        "CALLOPTIONDURATION": null,
        "ZSPREAD": -1.07,
        "ZSPREADATWAPRICE": -0.97
      },
      {
        "SECID": "SU26221RMFS0",
        "BID": 70.535,
        "BIDDEPTH": null,
        "OFFER": 70.581,
        "OFFERDEPTH": null,
        "SPREAD": 0.046,
        "BIDDEPTHT": 10774,
        "OFFERDEPTHT": 14695,
        "OPEN": 70.592,
        "LOW": 70.4,
        "HIGH": 70.97,
        "LAST": 70.575,
        "LASTCHANGE": 0.051,
        "LASTCHANGEPRCNT": 0.07,
        "QTY": 1,
        "VALUE": 705.75,
        "YIELD": 14.97,
        "VALUE_USD": 9.22,
        "WAPRICE": 70.533,
        "LASTCNGTOLASTWAPRICE": -0.134,
        "WAPTOPREVWAPRICEPRCNT": -0.25,
        "WAPTOPREVWAPRICE": -0.176,
        "YIELDATWAPRICE": 14.98,
        "YIELDTOPREVYIELD": 0.06,
        "CLOSEYIELD": 0,
        "CLOSEPRICE": null,
        "MARKETPRICETODAY": 70.533,
        "MARKETPRICE": 70.698,
        "LASTTOPREVPRICE": -0.02,
        "NUMTRADES": 1320,
        "VOLTODAY": 114501,
        "VALTODAY": 80761043,
        "VALTODAY_USD": 1054979,
        "BOARDID": "TQOB",
        "TRADINGSTATUS": "T",
        "UPDATETIME": "21:54:01",
        "DURATION": 1853,
        "NUMBIDS": null,
        "NUMOFFERS": null,
        "CHANGE": -0.017,
        "TIME": "21:51:13",
        "HIGHBID": null,
        "LOWOFFER": null,
        "PRICEMINUSPREVWAPRICE": -0.134,
        "LASTBID": null,
        "LASTOFFER": null,
        "LCURRENTPRICE": 70.544,
        "LCLOSEPRICE": 70.592,
        "MARKETPRICE2": 70.533,
        "OPENPERIODPRICE": null,
        "SEQNUM": 20260206220902,
        "SYSTIME": "2026-02-06 22:09:02",
        "VALTODAY_RUR": 80761043,
        "IRICPICLOSE": null,
        "BEICLOSE": null,
        "CBRCLOSE": null,
        "YIELDTOOFFER": null,
        "YIELDLASTCOUPON": null,
        "TRADINGSESSION": "2",
        "CALLOPTIONYIELD": null,
        "CALLOPTIONDURATION": null,
        "ZSPREAD": 0.7,
        "ZSPREADATWAPRICE": 0.71
      },
      {
        "SECID": "SU26224RMFS4",
        "BID": 81.4,
        "BIDDEPTH": null,
        "OFFER": 81.426,
        "OFFERDEPTH": null,
        "SPREAD": 0.026,
        "BIDDEPTHT": 72323,
        "OFFERDEPTHT": 13579,
        "OPEN": 81.602,
        "LOW": 81.218,
        "HIGH": 81.917,
        "LAST": 81.48,
        "LASTCHANGE": 0.08,
        "LASTCHANGEPRCNT": 0.1,
        "QTY": 20,
        "VALUE": 16296.0,
        "YIELD": 14.63,
        "VALUE_USD": 212.87,
        "WAPRICE": 81.62,
        "LASTCNGTOLASTWAPRICE": -0.323,
        "WAPTOPREVWAPRICEPRCNT": -0.22,
        "WAPTOPREVWAPRICE": -0.183,
        "YIELDATWAPRICE": 14.56,
        "YIELDTOPREVYIELD": 0.1,
        "CLOSEYIELD": 0,
        "CLOSEPRICE": null,
        "MARKETPRICETODAY": 81.626,
        "MARKETPRICE": 81.758,
        "LASTTOPREVPRICE": -0.44,
        "NUMTRADES": 757,
        "VOLTODAY": 360941,
        "VALTODAY": 294620008,
        "VALTODAY_USD": 3848611,
        "BOARDID": "TQOB",
        "TRADINGSTATUS": "T",
        "UPDATETIME": "21:54:01",
        "DURATION": 1062,
        "NUMBIDS": null,
        "NUMOFFERS": null,
        "CHANGE": -0.358,
        "TIME": "21:49:02",
        "HIGHBID": null,
        "LOWOFFER": null,
        "PRICEMINUSPREVWAPRICE": -0.323,
        "LASTBID": null,
        "LASTOFFER": null,
        "LCURRENTPRICE": 81.459,
        "LCLOSEPRICE": 81.23,
        "MARKETPRICE2": 81.626,
        "OPENPERIODPRICE": null,
        "SEQNUM": 20260206220902,
        "SYSTIME": "2026-02-06 22:09:02",
        "VALTODAY_RUR": 294620008,
        "IRICPICLOSE": null,
        "BEICLOSE": null,
        "CBRCLOSE": null,
        "YIELDTOOFFER": null,
        "YIELDLASTCOUPON": null,
        "TRADINGSESSION": "2",
        "CALLOPTIONYIELD": null,
        "CALLOPTIONDURATION": null,
        "ZSPREAD": 0.37,
        "ZSPREADATWAPRICE": 0.3
      },
      {
        "SECID": "SU26225RMFS1",
        "BID": 65.812,
        "BIDDEPTH": null,
        "OFFER": 65.818,
        "OFFERDEPTH": null,
        "SPREAD": 0.006,
        "BIDDEPTHT": 8478,
        "OFFERDEPTHT": 13997,
        "OPEN": 65.969,
        "LOW": 65.632,
        "HIGH": 66.159,
        "LAST": 65.818,
        "LASTCHANGE": 0.004,
        "LASTCHANGEPRCNT": 0.01,
        "QTY": 3,
        "VALUE": 1974.54,
        "YIELD": 15,
        "VALUE_USD": 25.79,
        "WAPRICE": 65.881,
        "LASTCNGTOLASTWAPRICE": -0.914,
        "WAPTOPREVWAPRICEPRCNT": -1.28,
        "WAPTOPREVWAPRICE": -0.851,
        "YIELDATWAPRICE": 14.98,
        "YIELDTOPREVYIELD": 0.26,
        "CLOSEYIELD": 0,
        "CLOSEPRICE": null,
        "MARKETPRICETODAY": 65.882,
        "MARKETPRICE": 66.09,
        "LASTTOPREVPRICE": -0.23,
        "NUMTRADES": 2128,
        "VOLTODAY": 229388,
        "VALTODAY": 151124026,
        "VALTODAY_USD": 1974128,
        "BOARDID": "TQOB",
        "TRADINGSTATUS": "T",
        "UPDATETIME": "21:54:01",
        "DURATION": 2080,
        "NUMBIDS": null,
        "NUMOFFERS": null,
        "CHANGE": -0.151,
        "TIME": "21:53:16",
        "HIGHBID": null,
        "LOWOFFER": null,
        "PRICEMINUSPREVWAPRICE": -0.914,
        "LASTBID": null,
        "LASTOFFER": null,
        "LCURRENTPRICE": 65.817,
        "LCLOSEPRICE": 65.804,
        "MARKETPRICE2": 65.882,
        "OPENPERIODPRICE": 65.969,
        "SEQNUM": 20260206220902,
        "SYSTIME": "2026-02-06 22:09:02",
        "VALTODAY_RUR": 151124026,
        "IRICPICLOSE": null,
        "BEICLOSE": null,
        "CBRCLOSE": null,
        "YIELDTOOFFER": null,
        "YIELDLASTCOUPON": null,
        "TRADINGSESSION": "2",
        "CALLOPTIONYIELD": null,
        "CALLOPTIONDURATION": null,
        "ZSPREAD": 0.76,
        "ZSPREADATWAPRICE": 0.74
      },
      {
        "SECID": "SU26226RMFS9",
        "BID": 96.165,
        "BIDDEPTH": null,
        "OFFER": 96.178,
        "OFFERDEPTH": null,
        "SPREAD": 0.013,
        "BIDDEPTHT": 51528,
        "OFFERDEPTHT": 85234,
        "OPEN": 96.19,
        "LOW": 96.1,
        "HIGH": 96.2,
        "LAST": 96.165,
        "LASTCHANGE": -0.013,
        "LASTCHANGEPRCNT": -0.01,
        "QTY": 1,
        "VALUE": 961.65,
        "YIELD": 14.72,
        "VALUE_USD": 12.56,
        "WAPRICE": 96.149,
        "LASTCNGTOLASTWAPRICE": -0.026,
        "WAPTOPREVWAPRICEPRCNT": -0.04,
        "WAPTOPREVWAPRICE": -0.042,
        "YIELDATWAPRICE": 14.75,
        "YIELDTOPREVYIELD": 0.16,
        "CLOSEYIELD": 0,
        "CLOSEPRICE": null,
        "MARKETPRICETODAY": 96.15,
        "MARKETPRICE": 96.196,
        "LASTTOPREVPRICE": 0.01,
        "NUMTRADES": 1100,
        "VOLTODAY": 89492,
        "VALTODAY": 86046015,
        "VALTODAY_USD": 1124016,
        "BOARDID": "TQOB",
        "TRADINGSTATUS": "T",
        "UPDATETIME": "21:54:01",
        "DURATION": 233,
        "NUMBIDS": null,
        "NUMOFFERS": null,
        "CHANGE": 0.006,
        "TIME": "21:45:18",
        "HIGHBID": null,
        "LOWOFFER": null,
        "PRICEMINUSPREVWAPRICE": -0.026,
        "LASTBID": null,
        "LASTOFFER": null,
        "LCURRENTPRICE": 96.177,
        "LCLOSEPRICE": 96.173,
        "MARKETPRICE2": 96.15,
        "OPENPERIODPRICE": null,
        "SEQNUM": 20260206220902,
        "SYSTIME": "2026-02-06 22:09:02",
        "VALTODAY_RUR": 86046015,
        "IRICPICLOSE": null,
        "BEICLOSE": null,
        "CBRCLOSE": null,
        "YIELDTOOFFER": null,
        "YIELDLASTCOUPON": null,
        "TRADINGSESSION": "2",
        "CALLOPTIONYIELD": null,
        "CALLOPTIONDURATION": null,
        "ZSPREAD": -0.87,
        "ZSPREADATWAPRICE": -0.84
      },
      {
        "SECID": "SU26228RMFS5",
        "BID": 79.851,
        "BIDDEPTH": null,
        "OFFER": 79.877,
        "OFFERDEPTH": null,
        "SPREAD": 0.026,
        "BIDDEPTHT": 5653,
        "OFFERDEPTHT": 209679,
        "OPEN": 79.882,
        "LOW": 79.785,
        "HIGH": 80.949,
        "LAST": 79.851,
        "LASTCHANGE": -0.105,
        "LASTCHANGEPRCNT": -0.13,
        "QTY": 1,
        "VALUE": 798.51,
        "YIELD": 14.72,
        "VALUE_USD": 10.43,
        "WAPRICE": 80.069,
        "LASTCNGTOLASTWAPRICE": -0.198,
        "WAPTOPREVWAPRICEPRCNT": 0.02,
        "WAPTOPREVWAPRICE": 0.02,
        "YIELDATWAPRICE": 14.63,
        "YIELDTOPREVYIELD": 0,
        "CLOSEYIELD": 0,
        "CLOSEPRICE": null,
        "MARKETPRICETODAY": 80.077,
        "MARKETPRICE": 80.008,
        "LASTTOPREVPRICE": -0.13,
        "NUMTRADES": 1220,
        "VOLTODAY": 34382,
        "VALTODAY": 27529332,
        "VALTODAY_USD": 359615,
        "BOARDID": "TQOB",
        "TRADINGSTATUS": "T",
        "UPDATETIME": "21:54:01",
        "DURATION": 1267,
        "NUMBIDS": null,
        "NUMOFFERS": null,
        "CHANGE": -0.105,
        "TIME": "21:50:40",
        "HIGHBID": null,
        "LOWOFFER": null,
        "PRICEMINUSPREVWAPRICE": -0.198,
        "LASTBID": null,
        "LASTOFFER": null,
        "LCURRENTPRICE": 79.851,
        "LCLOSEPRICE": 79.896,
        "MARKETPRICE2": 80.077,
        "OPENPERIODPRICE": 79.882,
        "SEQNUM": 20260206220902,
        "SYSTIME": "2026-02-06 22:09:02",
        "VALTODAY_RUR": 27529332,
        "IRICPICLOSE": null,
        "BEICLOSE": null,
        "CBRCLOSE": null,
        "YIELDTOOFFER": null,
        "YIELDLASTCOUPON": null,
        "TRADINGSESSION": "2",
        "CALLOPTIONYIELD": null,
        "CALLOPTIONDURATION": null,
        "ZSPREAD": 0.43,
        "ZSPREADATWAPRICE": 0.34
      },
      {
        "SECID": "SU26230RMFS1",
        "BID": 61.64,
        "BIDDEPTH": null,
        "OFFER": 61.686,
        "OFFERDEPTH": null,
        "SPREAD": 0.046,
        "BIDDEPTHT": 31417,
        "OFFERDEPTHT": 450940,
        "OPEN": 62.198,
        "LOW": 61.56,
        "HIGH": 62.28,
        "LAST": 61.663,
        "LASTCHANGE": 0.027,
        "LASTCHANGEPRCNT": 0.04,
        "QTY": 1,
        "VALUE": 616.63,
        "YIELD": 14.74,
        "VALUE_USD": 8.06,
        "WAPRICE": 61.683,
        "LASTCNGTOLASTWAPRICE": -0.382,
        "WAPTOPREVWAPRICEPRCNT": -0.58,
        "WAPTOPREVWAPRICE": -0.362,
        "YIELDATWAPRICE": 14.73,
        "YIELDTOPREVYIELD": 0.1,
        "CLOSEYIELD": 0,
        "CLOSEPRICE": null,
        "MARKETPRICETODAY": 61.68,
        "MARKETPRICE": 62.042,
        "LASTTOPREVPRICE": -0.7,
        "NUMTRADES": 3504,
        "VOLTODAY": 616605,
        "VALTODAY": 380340815,
        "VALTODAY_USD": 4968379,
        "BOARDID": "TQOB",
        "TRADINGSTATUS": "T",
        "UPDATETIME": "21:54:03",
        "DURATION": 2491,
        "NUMBIDS": null,
        "NUMOFFERS": null,
        "CHANGE": -0.437,
        "TIME": "21:52:56",
        "HIGHBID": null,
        "LOWOFFER": null,
        "PRICEMINUSPREVWAPRICE": -0.382,
        "LASTBID": null,
        "LASTOFFER": null,
        "LCURRENTPRICE": 61.657,
        "LCLOSEPRICE": 61.728,
        "MARKETPRICE2": 61.68,
        "OPENPERIODPRICE": 62.198,
        "SEQNUM": 20260206220904,
        "SYSTIME": "2026-02-06 22:09:04",
        "VALTODAY_RUR": 380340815,
        "IRICPICLOSE": null,
        "BEICLOSE": null,
        "CBRCLOSE": null,
        "YIELDTOOFFER": null,
        "YIELDLASTCOUPON": null,
        "TRADINGSESSION": "2",
        "CALLOPTIONYIELD": null,
        "CALLOPTIONDURATION": null,
        "ZSPREAD": 0.54,
        "ZSPREADATWAPRICE": 0.54
      },
      {
        "SECID": "SU26231RMFS9",
        "BID": 11,
        "BIDDEPTH": null,
        "OFFER": null,
        "OFFERDEPTH": null,
        "SPREAD": 0,
        "BIDDEPTHT": 15,
        "OFFERDEPTHT": 0,
        "OPEN": null,
        "LOW": null,
        "HIGH": null,
        "LAST": null,
        "LASTCHANGE": 0,
        "LASTCHANGEPRCNT": 0,
        "QTY": 0,
        "VALUE": 0.0,
        "YIELD": 0,
        "VALUE_USD": 0,
        "WAPRICE": null,
        "LASTCNGTOLASTWAPRICE": 0,
        "WAPTOPREVWAPRICEPRCNT": 0,
        "WAPTOPREVWAPRICE": 0,
        "YIELDATWAPRICE": 0,
        "YIELDTOPREVYIELD": 0,
        "CLOSEYIELD": 0,
        "CLOSEPRICE": null,
        "MARKETPRICETODAY": null,
        "MARKETPRICE": null,
        "LASTTOPREVPRICE": 0,
        "NUMTRADES": 0,
        "VOLTODAY": 0,
        "VALTODAY": 0,
        "VALTODAY_USD": 0,
        "BOARDID": "TQOB",
        "TRADINGSTATUS": "T",
        "UPDATETIME": "19:30:32",
        "DURATION": 0,
        "NUMBIDS": null,
        "NUMOFFERS": null,
        "CHANGE": null,
        "TIME": "19:30:32",
        "HIGHBID": null,
        "LOWOFFER": null,
        "PRICEMINUSPREVWAPRICE": null,
        "LASTBID": null,
        "LASTOFFER": null,
        "LCURRENTPRICE": null,
        "LCLOSEPRICE": null,
        "MARKETPRICE2": null,
        "OPENPERIODPRICE": null,
        "SEQNUM": 20260206194532,
        "SYSTIME": "2026-02-06 19:45:32",
        "VALTODAY_RUR": 0,
        "IRICPICLOSE": null,
        "BEICLOSE": null,
        "CBRCLOSE": null,
        "YIELDTOOFFER": null,
        "YIELDLASTCOUPON": null,
        "TRADINGSESSION": "2",
        "CALLOPTIONYIELD": null,
        "CALLOPTIONDURATION": null,
        "ZSPREAD": null,
        "ZSPREADATWAPRICE": null
      },
      {
        "SECID": "SU26232RMFS7",
        "BID": 88.581,
        "BIDDEPTH": null,
        "OFFER": 88.697,
        "OFFERDEPTH": null,
        "SPREAD": 0.116,
        "BIDDEPTHT": 47297,
        "OFFERDEPTHT": 70189,
        "OPEN": 88.845,
        "LOW": 88.504,
        "HIGH": 88.86,
        "LAST": 88.581,
        "LASTCHANGE": -0.119,
        "LASTCHANGEPRCNT": -0.13,
        "QTY": 1,
        "VALUE": 885.81,
        "YIELD": 14.44,
        "VALUE_USD": 11.57,
        "WAPRICE": 88.675,
        "LASTCNGTOLASTWAPRICE": -0.106,
        "WAPTOPREVWAPRICEPRCNT": -0.01,
        "WAPTOPREVWAPRICE": -0.012,
        "YIELDATWAPRICE": 14.36,
        "YIELDTOPREVYIELD": 0.05,
        "CLOSEYIELD": 0,
        "CLOSEPRICE": null,
        "MARKETPRICETODAY": 88.647,
        "MARKETPRICE": 88.589,
        "LASTTOPREVPRICE": -0.18,
        "NUMTRADES": 870,
        "VOLTODAY": 220044,
        "VALTODAY": 195062647,
        "VALTODAY_USD": 2548096,
        "BOARDID": "TQOB",
        "TRADINGSTATUS": "T",
        "UPDATETIME": "21:54:01",
        "DURATION": 570,
        "NUMBIDS": null,
        "NUMOFFERS": null,
        "CHANGE": -0.158,
        "TIME": "21:50:40",
        "HIGHBID": null,
        "LOWOFFER": null,
        "PRICEMINUSPREVWAPRICE": -0.106,
        "LASTBID": null,
        "LASTOFFER": null,
        "LCURRENTPRICE": 88.628,
        "LCLOSEPRICE": 88.728,
        "MARKETPRICE2": 88.647,
        "OPENPERIODPRICE": null,
        "SEQNUM": 20260206220902,
        "SYSTIME": "2026-02-06 22:09:02",
        "VALTODAY_RUR": 195062647,
        "IRICPICLOSE": null,
        "BEICLOSE": null,
        "CBRCLOSE": null,
        "YIELDTOOFFER": null,
        "YIELDLASTCOUPON": null,
        "TRADINGSESSION": "2",
        "CALLOPTIONYIELD": null,
        "CALLOPTIONDURATION": null,
        "ZSPREAD": 0.09,
        "ZSPREADATWAPRICE": 0.02
      },
      {
        "SECID": "SU26233RMFS5",
        "BID": 58.186,
        "BIDDEPTH": null,
        "OFFER": 58.187,
        "OFFERDEPTH": null,
        "SPREAD": 0.001,
        "BIDDEPTHT": 32960,
        "OFFERDEPTHT": 94507,
        "OPEN": 58.313,
        "LOW": 57.722,
        "HIGH": 58.399,
        "LAST": 58.186,
        "LASTCHANGE": -0.001,
        "LASTCHANGEPRCNT": 0,
        "QTY": 40,
        "VALUE": 23274.4,
        "YIELD": 14.82,
        "VALUE_USD": 304.03,
        "WAPRICE": 58.123,
        "LASTCNGTOLASTWAPRICE": -0.023,
        "WAPTOPREVWAPRICEPRCNT": -0.15,
        "WAPTOPREVWAPRICE": -0.086,
        "YIELDATWAPRICE": 14.84,
        "YIELDTOPREVYIELD": 0.03,
        "CLOSEYIELD": 0,
        "CLOSEPRICE": null,
        "MARKETPRICETODAY": 58.11,
        "MARKETPRICE": 58.279,
        "LASTTOPREVPRICE": -0.22,
        "NUMTRADES": 13043,
        "VOLTODAY": 233592,
        "VALTODAY": 135771124,
        "VALTODAY_USD": 1773573,
        "BOARDID": "TQOB",
        "TRADINGSTATUS": "T",
        "UPDATETIME": "21:54:01",
        "DURATION": 2372,
        "NUMBIDS": null,
        "NUMOFFERS": null,
        "CHANGE": -0.127,
        "TIME": "21:53:46",
        "HIGHBID": null,
        "LOWOFFER": null,
        "PRICEMINUSPREVWAPRICE": -0.023,
        "LASTBID": null,
        "LASTOFFER": null,
        "LCURRENTPRICE": 58.203,
        "LCLOSEPRICE": 58.033,
        "MARKETPRICE2": 58.11,
        "OPENPERIODPRICE": 58.313,
        "SEQNUM": 20260206220902,
        "SYSTIME": "2026-02-06 22:09:02",
        "VALTODAY_RUR": 135771124,
        "IRICPICLOSE": null,
        "BEICLOSE": null,
        "CBRCLOSE": null,
        "YIELDTOOFFER": null,
        "YIELDLASTCOUPON": null,
        "TRADINGSESSION": "2",
        "CALLOPTIONYIELD": null,
        "CALLOPTIONDURATION": null,
        "ZSPREAD": 0.6,
        "ZSPREADATWAPRICE": 0.62
      },
      {
        "SECID": "SU26235RMFS0",
        "BID": 70.387,
        "BIDDEPTH": null,
        "OFFER": 70.398,
        "OFFERDEPTH": null,
        "SPREAD": 0.011,
        "BIDDEPTHT": 353365,
        "OFFERDEPTHT": 8462,
        "OPEN": 70.687,
        "LOW": 70.044,
        "HIGH": 70.989,
        "LAST": 70.387,
        "LASTCHANGE": -0.012,
        "LASTCHANGEPRCNT": -0.02,
        "QTY": 5,
        "VALUE": 3519.35,
        "YIELD": 14.79,
        "VALUE_USD": 45.97,
        "WAPRICE": 70.471,
        "LASTCNGTOLASTWAPRICE": -0.275,
        "WAPTOPREVWAPRICEPRCNT": -0.27,
        "WAPTOPREVWAPRICE": -0.191,
        "YIELDATWAPRICE": 14.76,
        "YIELDTOPREVYIELD": 0.08,
        "CLOSEYIELD": 0,
        "CLOSEPRICE": null,
        "MARKETPRICETODAY": 70.484,
        "MARKETPRICE": 70.652,
        "LASTTOPREVPRICE": -0.37,
        "NUMTRADES": 1486,
        "VOLTODAY": 916311,
        "VALTODAY": 645850039,
        "VALTODAY_USD": 8436716,
        "BOARDID": "TQOB",
        "TRADINGSTATUS": "T",
        "UPDATETIME": "21:54:03",
        "DURATION": 1528,
        "NUMBIDS": null,
        "NUMOFFERS": null,
        "CHANGE": -0.264,
        "TIME": "21:54:03",
        "HIGHBID": null,
        "LOWOFFER": null,
        "PRICEMINUSPREVWAPRICE": -0.275,
        "LASTBID": null,
        "LASTOFFER": null,
        "LCURRENTPRICE": 70.39,
        "LCLOSEPRICE": 70.243,
        "MARKETPRICE2": 70.484,
        "OPENPERIODPRICE": null,
        "SEQNUM": 20260206220904,
        "SYSTIME": "2026-02-06 22:09:04",
        "VALTODAY_RUR": 645850039,
        "IRICPICLOSE": null,
        "BEICLOSE": null,
        "CBRCLOSE": null,
        "YIELDTOOFFER": null,
        "YIELDLASTCOUPON": null,
        "TRADINGSESSION": "2",
        "CALLOPTIONYIELD": null,
        "CALLOPTIONDURATION": null,
        "ZSPREAD": 0.5,
        "ZSPREADATWAPRICE": 0.47
      },
      {
        "SECID": "SU26236RMFS8",
        "BID": 84.151,
        "BIDDEPTH": null,
        "OFFER": 84.182,
        "OFFERDEPTH": null,
        "SPREAD": 0.031,
        "BIDDEPTHT": 284709,
        "OFFERDEPTHT": 56372,
        "OPEN": 84.402,
        "LOW": 84.051,
        "HIGH": 84.402,
        "LAST": 84.151,
        "LASTCHANGE": -0.001,
        "LASTCHANGEPRCNT": 0,
        "QTY": 1,
        "VALUE": 841.51,
        "YIELD": 14.59,
        "VALUE_USD": 10.99,
        "WAPRICE": 84.19,
        "LASTCNGTOLASTWAPRICE": -0.002,
        "WAPTOPREVWAPRICEPRCNT": 0.04,
        "WAPTOPREVWAPRICE": 0.037,
        "YIELDATWAPRICE": 14.56,
        "YIELDTOPREVYIELD": 0,
        "CLOSEYIELD": 0,
        "CLOSEPRICE": null,
        "MARKETPRICETODAY": 84.19,
        "MARKETPRICE": 84.153,
        "LASTTOPREVPRICE": 0,
        "NUMTRADES": 827,
        "VOLTODAY": 40025,
        "VALTODAY": 33696980,
        "VALTODAY_USD": 440182,
        "BOARDID": "TQOB",
        "TRADINGSTATUS": "T",
        "UPDATETIME": "21:54:01",
        "DURATION": 773,
        "NUMBIDS": null,
        "NUMOFFERS": null,
        "CHANGE": 0.003,
        "TIME": "21:50:46",
        "HIGHBID": null,
        "LOWOFFER": null,
        "PRICEMINUSPREVWAPRICE": -0.002,
        "LASTBID": null,
        "LASTOFFER": null,
        "LCURRENTPRICE": 84.169,
        "LCLOSEPRICE": 84.187,
        "MARKETPRICE2": 84.19,
        "OPENPERIODPRICE": null,
        "SEQNUM": 20260206220903,
        "SYSTIME": "2026-02-06 22:09:03",
        "VALTODAY_RUR": 33696980,
        "IRICPICLOSE": null,
        "BEICLOSE": null,
        "CBRCLOSE": null,
        "YIELDTOOFFER": null,
        "YIELDLASTCOUPON": null,
        "TRADINGSESSION": "2",
        "CALLOPTIONYIELD": null,
        "CALLOPTIONDURATION": null,
        "ZSPREAD": 0.36,
        "ZSPREADATWAPRICE": 0.34
      },
      {
        "SECID": "SU26237RMFS6",
        "BID": 81.917,
        "BIDDEPTH": null,
        "OFFER": 81.943,
        "OFFERDEPTH": null,
        "SPREAD": 0.026,
        "BIDDEPTHT": 10569,
        "OFFERDEPTHT": 3474,
        "OPEN": 82.452,
        "LOW": 81.9,
        "HIGH": 82.452,
        "LAST": 81.923,
        "LASTCHANGE": -0.078,
        "LASTCHANGEPRCNT": -0.1,
        "QTY": 1,
        "VALUE": 819.23,
        "YIELD": 14.6,
        "VALUE_USD": 10.7,
        "WAPRICE": 82.171,
        "LASTCNGTOLASTWAPRICE": -0.227,
        "WAPTOPREVWAPRICEPRCNT": 0.03,
        "WAPTOPREVWAPRICE": 0.021,
        "YIELDATWAPRICE": 14.48,
        "YIELDTOPREVYIELD": 0.01,
        "CLOSEYIELD": 0,
        "CLOSEPRICE": null,
        "MARKETPRICETODAY": 82.177,
        "MARKETPRICE": 82.156,
        "LASTTOPREVPRICE": -0.13,
        "NUMTRADES": 945,
        "VOLTODAY": 73633,
        "VALTODAY": 60504838,
        "VALTODAY_USD": 790373,
        "BOARDID": "TQOB",
        "TRADINGSTATUS": "T",
        "UPDATETIME": "21:54:01",
        "DURATION": 996,
        "NUMBIDS": null,
        "NUMOFFERS": null,
        "CHANGE": -0.103,
        "TIME": "21:50:40",
        "HIGHBID": null,
        "LOWOFFER": null,
        "PRICEMINUSPREVWAPRICE": -0.227,
        "LASTBID": null,
        "LASTOFFER": null,
        "LCURRENTPRICE": 81.948,
        "LCLOSEPRICE": 81.915,
        "MARKETPRICE2": 82.177,
        "OPENPERIODPRICE": null,
        "SEQNUM": 20260206220902,
        "SYSTIME": "2026-02-06 22:09:02",
        "VALTODAY_RUR": 60504838,
        "IRICPICLOSE": null,
        "BEICLOSE": null,
        "CBRCLOSE": null,
        "YIELDTOOFFER": null,
        "YIELDLASTCOUPON": null,
        "TRADINGSESSION": "2",
        "CALLOPTIONYIELD": null,
        "CALLOPTIONDURATION": null,
        "ZSPREAD": 0.35,
        "ZSPREADATWAPRICE": 0.22
      },
      {
        "SECID": "SU26238RMFS4",
        "BID": 58.225,
        "BIDDEPTH": null,
        "OFFER": 58.25,
        "OFFERDEPTH": null,
        "SPREAD": 0.025,
        "BIDDEPTHT": 326840,
        "OFFERDEPTHT": 368308,
        "OPEN": 58.36,
        "LOW": 58.081,
        "HIGH": 58.421,
        "LAST": 58.25,
        "LASTCHANGE": 0.025,
        "LASTCHANGEPRCNT": 0.04,
        "QTY": 1,
        "VALUE": 582.5,
        "YIELD": 14.15,
        "VALUE_USD": 7.61,
        "WAPRICE": 58.25,
        "LASTCNGTOLASTWAPRICE": -0.095,
        "WAPTOPREVWAPRICEPRCNT": -0.16,
        "WAPTOPREVWAPRICE": -0.095,
        "YIELDATWAPRICE": 14.15,
        "YIELDTOPREVYIELD": 0.03,
        "CLOSEYIELD": 0,
        "CLOSEPRICE": null,
        "MARKETPRICETODAY": 58.248,
        "MARKETPRICE": 58.343,
        "LASTTOPREVPRICE": -0.19,
        "NUMTRADES": 16684,
        "VOLTODAY": 892372,
        "VALTODAY": 519809357,
        "VALTODAY_USD": 6790251,
        "BOARDID": "TQOB",
        "TRADINGSTATUS": "T",
        "UPDATETIME": "21:54:01",
        "DURATION": 2752,
        "NUMBIDS": null,
        "NUMOFFERS": null,
        "CHANGE": -0.112,
        "TIME": "21:53:53",
        "HIGHBID": null,
        "LOWOFFER": null,
        "PRICEMINUSPREVWAPRICE": -0.095,
        "LASTBID": null,
        "LASTOFFER": null,
        "LCURRENTPRICE": 58.259,
        "LCLOSEPRICE": 58.09,
        "MARKETPRICE2": 58.248,
        "OPENPERIODPRICE": 58.36,
        "SEQNUM": 20260206220902,
        "SYSTIME": "2026-02-06 22:09:02",
        "VALTODAY_RUR": 519809357,
        "IRICPICLOSE": null,
        "BEICLOSE": null,
        "CBRCLOSE": null,
        "YIELDTOOFFER": null,
        "YIELDLASTCOUPON": null,
        "TRADINGSESSION": "2",
        "CALLOPTIONYIELD": null,
        "CALLOPTIONDURATION": null,
        "ZSPREAD": -0.04,
        "ZSPREADATWAPRICE": -0.04
      },
      {
        "SECID": "SU26239RMFS2",
        "BID": 72.676,
        "BIDDEPTH": null,
        "OFFER": 72.7,
        "OFFERDEPTH": null,
        "SPREAD": 0.024,
        "BIDDEPTHT": 10685,
        "OFFERDEPTHT": 5971,
        "OPEN": 72.81,
        "LOW": 72.504,
        "HIGH": 73.05,
        "LAST": 72.676,
        "LASTCHANGE": -0.052,
        "LASTCHANGEPRCNT": -0.07,
        "QTY": 1,
        "VALUE": 726.76,
        "YIELD": 14.79,
        "VALUE_USD": 9.49,
        "WAPRICE": 72.742,
        "LASTCNGTOLASTWAPRICE": -0.092,
        "WAPTOPREVWAPRICEPRCNT": -0.04,
        "WAPTOPREVWAPRICE": -0.026,
        "YIELDATWAPRICE": 14.77,
        "YIELDTOPREVYIELD": 0.02,
        "CLOSEYIELD": 0,
        "CLOSEPRICE": null,
        "MARKETPRICETODAY": 72.743,
        "MARKETPRICE": 72.767,
        "LASTTOPREVPRICE": -0.18,
        "NUMTRADES": 1262,
        "VOLTODAY": 49496,
        "VALTODAY": 36004310,
        "VALTODAY_USD": 470323,
        "BOARDID": "TQOB",
        "TRADINGSTATUS": "T",
        "UPDATETIME": "21:54:01",
        "DURATION": 1625,
        "NUMBIDS": null,
        "NUMOFFERS": null,
        "CHANGE": -0.134,
        "TIME": "21:50:40",
        "HIGHBID": null,
        "LOWOFFER": null,
        "PRICEMINUSPREVWAPRICE": -0.092,
        "LASTBID": null,
        "LASTOFFER": null,
        "LCURRENTPRICE": 72.708,
        "LCLOSEPRICE": 72.722,
        "MARKETPRICE2": 72.743,
        "OPENPERIODPRICE": null,
        "SEQNUM": 20260206220903,
        "SYSTIME": "2026-02-06 22:09:03",
        "VALTODAY_RUR": 36004310,
        "IRICPICLOSE": null,
        "BEICLOSE": null,
        "CBRCLOSE": null,
        "YIELDTOOFFER": null,
        "YIELDLASTCOUPON": null,
        "TRADINGSESSION": "2",
        "CALLOPTIONYIELD": null,
        "CALLOPTIONDURATION": null,
        "ZSPREAD": 0.53,
        "ZSPREADATWAPRICE": 0.5
      },
      {
        "SECID": "SU26240RMFS0",
        "BID": 62.03,
        "BIDDEPTH": null,
        "OFFER": 62.037,
        "OFFERDEPTH": null,
        "SPREAD": 0.007,
        "BIDDEPTHT": 22525,
        "OFFERDEPTHT": 39036,
        "OPEN": 62.032,
        "LOW": 61.653,
        "HIGH": 62.179,
        "LAST": 62.03,
        "LASTCHANGE": -0.001,
        "LASTCHANGEPRCNT": 0,
        "QTY": 100,
        "VALUE": 62030.0,
        "YIELD": 14.51,
        "VALUE_USD": 810.3,
        "WAPRICE": 61.889,
        "LASTCNGTOLASTWAPRICE": 0.06,
        "WAPTOPREVWAPRICEPRCNT": -0.13,
        "WAPTOPREVWAPRICE": -0.081,
        "YIELDATWAPRICE": 14.55,
        "YIELDTOPREVYIELD": 0.03,
        "CLOSEYIELD": 0,
        "CLOSEPRICE": null,
        "MARKETPRICETODAY": 61.898,
        "MARKETPRICE": 62.012,
        "LASTTOPREVPRICE": 0,
        "NUMTRADES": 8353,
        "VOLTODAY": 164126,
        "VALTODAY": 101616121,
        "VALTODAY_USD": 1327408,
        "BOARDID": "TQOB",
        "TRADINGSTATUS": "T",
        "UPDATETIME": "21:54:04",
        "DURATION": 2315,
        "NUMBIDS": null,
        "NUMOFFERS": null,
        "CHANGE": -0.002,
        "TIME": "21:54:03",
        "HIGHBID": null,
        "LOWOFFER": null,
        "PRICEMINUSPREVWAPRICE": 0.06,
        "LASTBID": null,
        "LASTOFFER": null,
        "LCURRENTPRICE": 62.043,
        "LCLOSEPRICE": 61.653,
        "MARKETPRICE2": 61.898,
        "OPENPERIODPRICE": 62.032,
        "SEQNUM": 20260206220905,
        "SYSTIME": "2026-02-06 22:09:05",
        "VALTODAY_RUR": 101616121,
        "IRICPICLOSE": null,
        "BEICLOSE": null,
        "CBRCLOSE": null,
        "YIELDTOOFFER": null,
        "YIELDLASTCOUPON": null,
        "TRADINGSESSION": "2",
        "CALLOPTIONYIELD": null,
        "CALLOPTIONDURATION": null,
        "ZSPREAD": 0.3,
        "ZSPREADATWAPRICE": 0.34
      },
      {
        "SECID": "SU26241RMFS8",
        "BID": 78.871,
        "BIDDEPTH": null,
        "OFFER": 78.88,
        "OFFERDEPTH": null,
        "SPREAD": 0.009,
        "BIDDEPTHT": 15798,
        "OFFERDEPTHT": 9741,
        "OPEN": 78.943,
        "LOW": 78.8,
        "HIGH": 79.396,
        "LAST": 78.88,
        "LASTCHANGE": -0.002,
        "LASTCHANGEPRCNT": 0,
        "QTY": 6,
        "VALUE": 4732.8,
        "YIELD": 15.01,
        "VALUE_USD": 61.82,
        "WAPRICE": 79.086,
        "LASTCNGTOLASTWAPRICE": -0.218,
        "WAPTOPREVWAPRICEPRCNT": -0.02,
        "WAPTOPREVWAPRICE": -0.012,
        "YIELDATWAPRICE": 14.95,
        "YIELDTOPREVYIELD": 0.01,
        "CLOSEYIELD": 0,
        "CLOSEPRICE": null,
        "MARKETPRICETODAY": 79.087,
        "MARKETPRICE": 79.099,
        "LASTTOPREVPRICE": -0.08,
        "NUMTRADES": 1867,
        "VOLTODAY": 508123,
        "VALTODAY": 401853328,
        "VALTODAY_USD": 5249396,
        "BOARDID": "TQOB",
        "TRADINGSTATUS": "T",
        "UPDATETIME": "21:54:01",
        "DURATION": 1753,
        "NUMBIDS": null,
        "NUMOFFERS": null,
        "CHANGE": -0.063,
        "TIME": "21:53:12",
        "HIGHBID": null,
        "LOWOFFER": null,
        "PRICEMINUSPREVWAPRICE": -0.218,
        "LASTBID": null,
        "LASTOFFER": null,
        "LCURRENTPRICE": 78.881,
        "LCLOSEPRICE": 78.9,
        "MARKETPRICE2": 79.087,
        "OPENPERIODPRICE": null,
        "SEQNUM": 20260206220902,
        "SYSTIME": "2026-02-06 22:09:02",
        "VALTODAY_RUR": 401853328,
        "IRICPICLOSE": null,
        "BEICLOSE": null,
        "CBRCLOSE": null,
        "YIELDTOOFFER": null,
        "YIELDLASTCOUPON": null,
        "TRADINGSESSION": "2",
        "CALLOPTIONYIELD": null,
        "CALLOPTIONDURATION": null,
        "ZSPREAD": 0.74,
        "ZSPREADATWAPRICE": 0.68
      },
      {
        "SECID": "SU26242RMFS6",
        "BID": 85.93,
        "BIDDEPTH": null,
        "OFFER": 85.996,
        "OFFERDEPTH": null,
        "SPREAD": 0.066,
        "BIDDEPTHT": 6877,
        "OFFERDEPTHT": 6625,
        "OPEN": 86.129,
        "LOW": 85.512,
        "HIGH": 86.384,
        "LAST": 85.999,
        "LASTCHANGE": -0.002,
        "LASTCHANGEPRCNT": 0,
        "QTY": 1,
        "VALUE": 859.99,
        "YIELD": 14.64,
        "VALUE_USD": 11.23,
        "WAPRICE": 86.129,
        "LASTCNGTOLASTWAPRICE": -0.149,
        "WAPTOPREVWAPRICEPRCNT": -0.02,
        "WAPTOPREVWAPRICE": -0.019,
        "YIELDATWAPRICE": 14.59,
        "YIELDTOPREVYIELD": 0.02,
        "CLOSEYIELD": 0,
        "CLOSEPRICE": null,
        "MARKETPRICETODAY": 86.149,
        "MARKETPRICE": 86.145,
        "LASTTOPREVPRICE": 0.05,
        "NUMTRADES": 2146,
        "VOLTODAY": 57084,
        "VALTODAY": 49172586,
        "VALTODAY_USD": 642340,
        "BOARDID": "TQOB",
        "TRADINGSTATUS": "T",
        "UPDATETIME": "21:54:01",
        "DURATION": 1076,
        "NUMBIDS": null,
        "NUMOFFERS": null,
        "CHANGE": 0.039,
        "TIME": "21:53:15",
        "HIGHBID": null,
        "LOWOFFER": null,
        "PRICEMINUSPREVWAPRICE": -0.149,
        "LASTBID": null,
        "LASTOFFER": null,
        "LCURRENTPRICE": 86.003,
        "LCLOSEPRICE": 85.926,
        "MARKETPRICE2": 86.149,
        "OPENPERIODPRICE": null,
        "SEQNUM": 20260206220902,
        "SYSTIME": "2026-02-06 22:09:02",
        "VALTODAY_RUR": 49172586,
        "IRICPICLOSE": null,
        "BEICLOSE": null,
        "CBRCLOSE": null,
        "YIELDTOOFFER": null,
        "YIELDLASTCOUPON": null,
        "TRADINGSESSION": "2",
        "CALLOPTIONYIELD": null,
        "CALLOPTIONDURATION": null,
        "ZSPREAD": 0.37,
        "ZSPREADATWAPRICE": 0.31
      },
      {
        "SECID": "SU26243RMFS4",
        "BID": 73.099,
        "BIDDEPTH": null,
        "OFFER": 73.1,
        "OFFERDEPTH": null,
        "SPREAD": 0.001,
        "BIDDEPTHT": 44601,
        "OFFERDEPTHT": 128054,
        "OPEN": 73.457,
        "LOW": 72.95,
        "HIGH": 73.572,
        "LAST": 73.099,
        "LASTCHANGE": -0.001,
        "LASTCHANGEPRCNT": 0,
        "QTY": 2,
        "VALUE": 1461.98,
        "YIELD": 15.09,
        "VALUE_USD": 19.1,
        "WAPRICE": 73.159,
        "LASTCNGTOLASTWAPRICE": -0.428,
        "WAPTOPREVWAPRICEPRCNT": -0.5,
        "WAPTOPREVWAPRICE": -0.368,
        "YIELDATWAPRICE": 15.08,
        "YIELDTOPREVYIELD": 0.09,
        "CLOSEYIELD": 0,
        "CLOSEPRICE": null,
        "MARKETPRICETODAY": 73.158,
        "MARKETPRICE": 73.525,
        "LASTTOPREVPRICE": -0.54,
        "NUMTRADES": 4494,
        "VOLTODAY": 669434,
        "VALTODAY": 489753795,
        "VALTODAY_USD": 6397637,
        "BOARDID": "TQOB",
        "TRADINGSTATUS": "T",
        "UPDATETIME": "21:54:01",
        "DURATION": 2336,
        "NUMBIDS": null,
        "NUMOFFERS": null,
        "CHANGE": -0.4,
        "TIME": "21:52:44",
        "HIGHBID": null,
        "LOWOFFER": null,
        "PRICEMINUSPREVWAPRICE": -0.428,
        "LASTBID": null,
        "LASTOFFER": null,
        "LCURRENTPRICE": 73.11,
        "LCLOSEPRICE": 73.065,
        "MARKETPRICE2": 73.158,
        "OPENPERIODPRICE": null,
        "SEQNUM": 20260206220902,
        "SYSTIME": "2026-02-06 22:09:02",
        "VALTODAY_RUR": 489753795,
        "IRICPICLOSE": null,
        "BEICLOSE": null,
        "CBRCLOSE": null,
        "YIELDTOOFFER": null,
        "YIELDLASTCOUPON": null,
        "TRADINGSESSION": "2",
        "CALLOPTIONYIELD": null,
        "CALLOPTIONDURATION": null,
        "ZSPREAD": 0.89,
        "ZSPREADATWAPRICE": 0.87
      },
      {
        "SECID": "SU26244RMFS2",
        "BID": 85.038,
        "BIDDEPTH": null,
        "OFFER": 85.136,
        "OFFERDEPTH": null,
        "SPREAD": 0.098,
        "BIDDEPTHT": 12716,
        "OFFERDEPTHT": 18040,
        "OPEN": 85.086,
        "LOW": 84.8,
        "HIGH": 85.5,
        "LAST": 85.036,
        "LASTCHANGE": -0.109,
        "LASTCHANGEPRCNT": -0.13,
        "QTY": 12,
        "VALUE": 10204.32,
        "YIELD": 14.96,
        "VALUE_USD": 133.3,
        "WAPRICE": 85,
        "LASTCNGTOLASTWAPRICE": -0.121,
        "WAPTOPREVWAPRICEPRCNT": -0.18,
        "WAPTOPREVWAPRICE": -0.157,
        "YIELDATWAPRICE": 14.97,
        "YIELDTOPREVYIELD": 0.05,
        "CLOSEYIELD": 0,
        "CLOSEPRICE": null,
        "MARKETPRICETODAY": 84.998,
        "MARKETPRICE": 85.156,
        "LASTTOPREVPRICE": -0.14,
        "NUMTRADES": 2854,
        "VOLTODAY": 138437,
        "VALTODAY": 117671893,
        "VALTODAY_USD": 1537144,
        "BOARDID": "TQOB",
        "TRADINGSTATUS": "T",
        "UPDATETIME": "21:54:01",
        "DURATION": 1838,
        "NUMBIDS": null,
        "NUMOFFERS": null,
        "CHANGE": -0.123,
        "TIME": "21:51:55",
        "HIGHBID": null,
        "LOWOFFER": null,
        "PRICEMINUSPREVWAPRICE": -0.121,
        "LASTBID": null,
        "LASTOFFER": null,
        "LCURRENTPRICE": 85.097,
        "LCLOSEPRICE": 84.917,
        "MARKETPRICE2": 84.998,
        "OPENPERIODPRICE": null,
        "SEQNUM": 20260206220902,
        "SYSTIME": "2026-02-06 22:09:02",
        "VALTODAY_RUR": 117671893,
        "IRICPICLOSE": null,
        "BEICLOSE": null,
        "CBRCLOSE": null,
        "YIELDTOOFFER": null,
        "YIELDLASTCOUPON": null,
        "TRADINGSESSION": "2",
        "CALLOPTIONYIELD": null,
        "CALLOPTIONDURATION": null,
        "ZSPREAD": 0.71,
        "ZSPREADATWAPRICE": 0.72
      },
      {
        "SECID": "SU26245RMFS9",
        "BID": 86.838,
        "BIDDEPTH": null,
        "OFFER": 86.921,
        "OFFERDEPTH": null,
        "SPREAD": 0.083,
        "BIDDEPTHT": 68736,
        "OFFERDEPTHT": 406022,
        "OPEN": 87.377,
        "LOW": 86.583,
        "HIGH": 87.496,
        "LAST": 86.921,
        "LASTCHANGE": 0.018,
        "LASTCHANGEPRCNT": 0.02,
        "QTY": 2,
        "VALUE": 1738.42,
        "YIELD": 15.09,
        "VALUE_USD": 22.71,
        "WAPRICE": 87.017,
        "LASTCNGTOLASTWAPRICE": -0.389,
        "WAPTOPREVWAPRICEPRCNT": -0.34,
        "WAPTOPREVWAPRICE": -0.293,
        "YIELDATWAPRICE": 15.07,
        "YIELDTOPREVYIELD": 0.07,
        "CLOSEYIELD": 0,
        "CLOSEPRICE": null,
        "MARKETPRICETODAY": 87.056,
        "MARKETPRICE": 87.309,
        "LASTTOPREVPRICE": -0.52,
        "NUMTRADES": 4910,
        "VOLTODAY": 650722,
        "VALTODAY": 566483438,
        "VALTODAY_USD": 7399953,
        "BOARDID": "TQOB",
        "TRADINGSTATUS": "T",
        "UPDATETIME": "21:54:03",
        "DURATION": 1984,
        "NUMBIDS": null,
        "NUMOFFERS": null,
        "CHANGE": -0.455,
        "TIME": "21:52:17",
        "HIGHBID": null,
        "LOWOFFER": null,
        "PRICEMINUSPREVWAPRICE": -0.389,
        "LASTBID": null,
        "LASTOFFER": null,
        "LCURRENTPRICE": 86.856,
        "LCLOSEPRICE": 86.768,
        "MARKETPRICE2": 87.056,
        "OPENPERIODPRICE": 87.377,
        "SEQNUM": 20260206220904,
        "SYSTIME": "2026-02-06 22:09:04",
        "VALTODAY_RUR": 566483438,
        "IRICPICLOSE": null,
        "BEICLOSE": null,
        "CBRCLOSE": null,
        "YIELDTOOFFER": null,
        "YIELDLASTCOUPON": null,
        "TRADINGSESSION": "2",
        "CALLOPTIONYIELD": null,
        "CALLOPTIONDURATION": null,
        "ZSPREAD": 0.86,
        "ZSPREADATWAPRICE": 0.83
      },
      {
        "SECID": "SU26246RMFS7",
        "BID": 86.564,
        "BIDDEPTH": null,
        "OFFER": 86.565,
        "OFFERDEPTH": null,
        "SPREAD": 0.001,
        "BIDDEPTHT": 45117,
        "OFFERDEPTHT": 452624,
        "OPEN": 87.11,
        "LOW": 86.41,
        "HIGH": 87.297,
        "LAST": 86.565,
        "LASTCHANGE": -0.001,
        "LASTCHANGEPRCNT": 0,
        "QTY": 2,
        "VALUE": 1731.3,
        "YIELD": 15.11,
        "VALUE_USD": 22.62,
        "WAPRICE": 86.683,
        "LASTCNGTOLASTWAPRICE": -0.386,
        "WAPTOPREVWAPRICEPRCNT": -0.31,
        "WAPTOPREVWAPRICE": -0.268,
        "YIELDATWAPRICE": 15.08,
        "YIELDTOPREVYIELD": 0.06,
        "CLOSEYIELD": 0,
        "CLOSEPRICE": null,
        "MARKETPRICETODAY": 86.683,
        "MARKETPRICE": 86.946,
        "LASTTOPREVPRICE": -0.49,
        "NUMTRADES": 8616,
        "VOLTODAY": 437420,
        "VALTODAY": 379167200,
        "VALTODAY_USD": 4953048,
        "BOARDID": "TQOB",
        "TRADINGSTATUS": "T",
        "UPDATETIME": "21:54:03",
        "DURATION": 2016,
        "NUMBIDS": null,
        "NUMOFFERS": null,
        "CHANGE": -0.425,
        "TIME": "21:54:00",
        "HIGHBID": null,
        "LOWOFFER": null,
        "PRICEMINUSPREVWAPRICE": -0.386,
        "LASTBID": null,
        "LASTOFFER": null,
        "LCURRENTPRICE": 86.567,
        "LCLOSEPRICE": 86.596,
        "MARKETPRICE2": 86.683,
        "OPENPERIODPRICE": 87.11,
        "SEQNUM": 20260206220904,
        "SYSTIME": "2026-02-06 22:09:04",
        "VALTODAY_RUR": 379167200,
        "IRICPICLOSE": null,
        "BEICLOSE": null,
        "CBRCLOSE": null,
        "YIELDTOOFFER": null,
        "YIELDLASTCOUPON": null,
        "TRADINGSESSION": "2",
        "CALLOPTIONYIELD": null,
        "CALLOPTIONDURATION": null,
        "ZSPREAD": 0.88,
        "ZSPREADATWAPRICE": 0.85
      },
      {
        "SECID": "SU26247RMFS5",
        "BID": 86.549,
        "BIDDEPTH": null,
        "OFFER": 86.55,
        "OFFERDEPTH": null,
        "SPREAD": 0.001,
        "BIDDEPTHT": 83541,
        "OFFERDEPTHT": 318050,
        "OPEN": 87.187,
        "LOW": 86.485,
        "HIGH": 87.187,
        "LAST": 86.55,
        "LASTCHANGE": 0.001,
        "LASTCHANGEPRCNT": 0,
        "QTY": 150,
        "VALUE": 129825.0,
        "YIELD": 15.09,
        "VALUE_USD": 1695.9,
        "WAPRICE": 86.69,
        "LASTCNGTOLASTWAPRICE": -0.571,
        "WAPTOPREVWAPRICEPRCNT": -0.49,
        "WAPTOPREVWAPRICE": -0.431,
        "YIELDATWAPRICE": 15.06,
        "YIELDTOPREVYIELD": 0.09,
        "CLOSEYIELD": 0,
        "CLOSEPRICE": null,
        "MARKETPRICETODAY": 86.787,
        "MARKETPRICE": 87.116,
        "LASTTOPREVPRICE": -0.73,
        "NUMTRADES": 10591,
        "VOLTODAY": 920154,
        "VALTODAY": 798518857,
        "VALTODAY_USD": 10431024,
        "BOARDID": "TQOB",
        "TRADINGSTATUS": "T",
        "UPDATETIME": "21:54:01",
        "DURATION": 2283,
        "NUMBIDS": null,
        "NUMOFFERS": null,
        "CHANGE": -0.637,
        "TIME": "21:53:31",
        "HIGHBID": null,
        "LOWOFFER": null,
        "PRICEMINUSPREVWAPRICE": -0.571,
        "LASTBID": null,
        "LASTOFFER": null,
        "LCURRENTPRICE": 86.549,
        "LCLOSEPRICE": 86.552,
        "MARKETPRICE2": 86.787,
        "OPENPERIODPRICE": 87.187,
        "SEQNUM": 20260206220902,
        "SYSTIME": "2026-02-06 22:09:02",
        "VALTODAY_RUR": 798518857,
        "IRICPICLOSE": null,
        "BEICLOSE": null,
        "CBRCLOSE": null,
        "YIELDTOOFFER": null,
        "YIELDLASTCOUPON": null,
        "TRADINGSESSION": "2",
        "CALLOPTIONYIELD": null,
        "CALLOPTIONDURATION": null,
        "ZSPREAD": 0.88,
        "ZSPREADATWAPRICE": 0.86
      },
      {
        "SECID": "SU26248RMFS3",
        "BID": 86.441,
        "BIDDEPTH": null,
        "OFFER": 86.449,
        "OFFERDEPTH": null,
        "SPREAD": 0.008,
        "BIDDEPTHT": 216060,
        "OFFERDEPTHT": 663743,
        "OPEN": 87.249,
        "LOW": 86.39,
        "HIGH": 87.269,
        "LAST": 86.449,
        "LASTCHANGE": 0.009,
        "LASTCHANGEPRCNT": 0.01,
        "QTY": 1,
        "VALUE": 864.49,
        "YIELD": 15.04,
        "VALUE_USD": 11.29,
        "WAPRICE": 86.395,
        "LASTCNGTOLASTWAPRICE": -0.694,
        "WAPTOPREVWAPRICEPRCNT": -0.86,
        "WAPTOPREVWAPRICE": -0.748,
        "YIELDATWAPRICE": 15.06,
        "YIELDTOPREVYIELD": 0.16,
        "CLOSEYIELD": 0,
        "CLOSEPRICE": null,
        "MARKETPRICETODAY": 86.677,
        "MARKETPRICE": 87.137,
        "LASTTOPREVPRICE": -0.92,
        "NUMTRADES": 24320,
        "VOLTODAY": 2854114,
        "VALTODAY": 2473534864,
        "VALTODAY_USD": 32311699,
        "BOARDID": "TQOB",
        "TRADINGSTATUS": "T",
        "UPDATETIME": "21:54:04",
        "DURATION": 2342,
        "NUMBIDS": null,
        "NUMOFFERS": null,
        "CHANGE": -0.8,
        "TIME": "21:54:04",
        "HIGHBID": null,
        "LOWOFFER": null,
        "PRICEMINUSPREVWAPRICE": -0.694,
        "LASTBID": null,
        "LASTOFFER": null,
        "LCURRENTPRICE": 86.449,
        "LCLOSEPRICE": 86.5,
        "MARKETPRICE2": 86.677,
        "OPENPERIODPRICE": 87.249,
        "SEQNUM": 20260206220905,
        "SYSTIME": "2026-02-06 22:09:05",
        "VALTODAY_RUR": 2473534864,
        "IRICPICLOSE": null,
        "BEICLOSE": null,
        "CBRCLOSE": null,
        "YIELDTOOFFER": null,
        "YIELDLASTCOUPON": null,
        "TRADINGSESSION": "2",
        "CALLOPTIONYIELD": null,
        "CALLOPTIONDURATION": null,
        "ZSPREAD": 0.83,
        "ZSPREADATWAPRICE": 0.84
      },
      {
        "SECID": "SU26249RMFS1",
        "BID": 85.751,
        "BIDDEPTH": null,
        "OFFER": 85.786,
        "OFFERDEPTH": null,
        "SPREAD": 0.035,
        "BIDDEPTHT": 13395,
        "OFFERDEPTHT": 1142010,
        "OPEN": 85.992,
        "LOW": 85.615,
        "HIGH": 86.192,
        "LAST": 85.786,
        "LASTCHANGE": 0.04,
        "LASTCHANGEPRCNT": 0.05,
        "QTY": 1,
        "VALUE": 857.86,
        "YIELD": 15.01,
        "VALUE_USD": 11.21,
        "WAPRICE": 85.67,
        "LASTCNGTOLASTWAPRICE": -0.156,
        "WAPTOPREVWAPRICEPRCNT": -0.32,
        "WAPTOPREVWAPRICE": -0.272,
        "YIELDATWAPRICE": 15.05,
        "YIELDTOPREVYIELD": 0.08,
        "CLOSEYIELD": 0,
        "CLOSEPRICE": null,
        "MARKETPRICETODAY": 85.767,
        "MARKETPRICE": 85.937,
        "LASTTOPREVPRICE": -0.3,
        "NUMTRADES": 1498,
        "VOLTODAY": 300333,
        "VALTODAY": 257590871,
        "VALTODAY_USD": 3364900,
        "BOARDID": "TQOB",
        "TRADINGSTATUS": "T",
        "UPDATETIME": "21:54:01",
        "DURATION": 1649,
        "NUMBIDS": null,
        "NUMOFFERS": null,
        "CHANGE": -0.262,
        "TIME": "21:53:57",
        "HIGHBID": null,
        "LOWOFFER": null,
        "PRICEMINUSPREVWAPRICE": -0.156,
        "LASTBID": null,
        "LASTOFFER": null,
        "LCURRENTPRICE": 85.785,
        "LCLOSEPRICE": 85.782,
        "MARKETPRICE2": 85.767,
        "OPENPERIODPRICE": null,
        "SEQNUM": 20260206220902,
        "SYSTIME": "2026-02-06 22:09:02",
        "VALTODAY_RUR": 257590871,
        "IRICPICLOSE": null,
        "BEICLOSE": null,
        "CBRCLOSE": null,
        "YIELDTOOFFER": null,
        "YIELDLASTCOUPON": null,
        "TRADINGSESSION": "2",
        "CALLOPTIONYIELD": null,
        "CALLOPTIONDURATION": null,
        "ZSPREAD": 0.75,
        "ZSPREADATWAPRICE": 0.79
      },
      {
        "SECID": "SU26250RMFS9",
        "BID": 85.769,
        "BIDDEPTH": null,
        "OFFER": 85.78,
        "OFFERDEPTH": null,
        "SPREAD": 0.011,
        "BIDDEPTHT": 63169,
        "OFFERDEPTHT": 50769,
        "OPEN": 86.019,
        "LOW": 85.6,
        "HIGH": 86.2,
        "LAST": 85.785,
        "LASTCHANGE": 0.001,
        "LASTCHANGEPRCNT": 0,
        "QTY": 4,
        "VALUE": 3431.4,
        "YIELD": 15.13,
        "VALUE_USD": 44.82,
        "WAPRICE": 85.823,
        "LASTCNGTOLASTWAPRICE": -0.26,
        "WAPTOPREVWAPRICEPRCNT": -0.26,
        "WAPTOPREVWAPRICE": -0.222,
        "YIELDATWAPRICE": 15.12,
        "YIELDTOPREVYIELD": 0.05,
        "CLOSEYIELD": 0,
        "CLOSEPRICE": null,
        "MARKETPRICETODAY": 85.828,
        "MARKETPRICE": 86.042,
        "LASTTOPREVPRICE": -0.27,
        "NUMTRADES": 8528,
        "VOLTODAY": 1570680,
        "VALTODAY": 1347997365,
        "VALTODAY_USD": 17608842,
        "BOARDID": "TQOB",
        "TRADINGSTATUS": "T",
        "UPDATETIME": "21:54:01",
        "DURATION": 2187,
        "NUMBIDS": null,
        "NUMOFFERS": null,
        "CHANGE": -0.234,
        "TIME": "21:52:28",
        "HIGHBID": null,
        "LOWOFFER": null,
        "PRICEMINUSPREVWAPRICE": -0.26,
        "LASTBID": null,
        "LASTOFFER": null,
        "LCURRENTPRICE": 85.771,
        "LCLOSEPRICE": 85.6,
        "MARKETPRICE2": 85.828,
        "OPENPERIODPRICE": 86.019,
        "SEQNUM": 20260206220902,
        "SYSTIME": "2026-02-06 22:09:02",
        "VALTODAY_RUR": 1347997365,
        "IRICPICLOSE": null,
        "BEICLOSE": null,
        "CBRCLOSE": null,
        "YIELDTOOFFER": null,
        "YIELDLASTCOUPON": null,
        "TRADINGSESSION": "2",
        "CALLOPTIONYIELD": null,
        "CALLOPTIONDURATION": null,
        "ZSPREAD": 0.92,
        "ZSPREADATWAPRICE": 0.91
      },
      {
        "SECID": "SU26251RMFS7",
        "BID": 84.251,
        "BIDDEPTH": null,
        "OFFER": 84.26,
        "OFFERDEPTH": null,
        "SPREAD": 0.009,
        "BIDDEPTHT": 56773,
        "OFFERDEPTHT": 429862,
        "OPEN": 84.41,
        "LOW": 84,
        "HIGH": 84.6,
        "LAST": 84.26,
        "LASTCHANGE": -0.002,
        "LASTCHANGEPRCNT": 0,
        "QTY": 1,
        "VALUE": 842.6,
        "YIELD": 14.83,
        "VALUE_USD": 11.01,
        "WAPRICE": 84.102,
        "LASTCNGTOLASTWAPRICE": 0.045,
        "WAPTOPREVWAPRICEPRCNT": -0.13,
        "WAPTOPREVWAPRICE": -0.113,
        "YIELDATWAPRICE": 14.89,
        "YIELDTOPREVYIELD": 0.05,
        "CLOSEYIELD": 0,
        "CLOSEPRICE": null,
        "MARKETPRICETODAY": 84.092,
        "MARKETPRICE": 84.24,
        "LASTTOPREVPRICE": 0.04,
        "NUMTRADES": 1299,
        "VOLTODAY": 697033,
        "VALTODAY": 586157202,
        "VALTODAY_USD": 7656951,
        "BOARDID": "TQOB",
        "TRADINGSTATUS": "T",
        "UPDATETIME": "21:54:01",
        "DURATION": 1292,
        "NUMBIDS": null,
        "NUMOFFERS": null,
        "CHANGE": 0.035,
        "TIME": "21:53:27",
        "HIGHBID": null,
        "LOWOFFER": null,
        "PRICEMINUSPREVWAPRICE": 0.045,
        "LASTBID": null,
        "LASTOFFER": null,
        "LCURRENTPRICE": 84.261,
        "LCLOSEPRICE": 84.143,
        "MARKETPRICE2": 84.092,
        "OPENPERIODPRICE": 84.41,
        "SEQNUM": 20260206220902,
        "SYSTIME": "2026-02-06 22:09:02",
        "VALTODAY_RUR": 586157202,
        "IRICPICLOSE": null,
        "BEICLOSE": null,
        "CBRCLOSE": null,
        "YIELDTOOFFER": null,
        "YIELDLASTCOUPON": null,
        "TRADINGSESSION": "2",
        "CALLOPTIONYIELD": null,
        "CALLOPTIONDURATION": null,
        "ZSPREAD": 0.54,
        "ZSPREADATWAPRICE": 0.6
      },
      {
        "SECID": "SU26252RMFS5",
        "BID": 90.642,
        "BIDDEPTH": null,
        "OFFER": 90.65,
        "OFFERDEPTH": null,
        "SPREAD": 0.008,
        "BIDDEPTHT": 41638,
        "OFFERDEPTHT": 709699,
        "OPEN": 91.07,
        "LOW": 90.48,
        "HIGH": 91.17,
        "LAST": 90.65,
        "LASTCHANGE": 0.008,
        "LASTCHANGEPRCNT": 0.01,
        "QTY": 2,
        "VALUE": 1813.0,
        "YIELD": 15.08,
        "VALUE_USD": 23.68,
        "WAPRICE": 90.732,
        "LASTCNGTOLASTWAPRICE": -0.335,
        "WAPTOPREVWAPRICEPRCNT": -0.28,
        "WAPTOPREVWAPRICE": -0.253,
        "YIELDATWAPRICE": 15.06,
        "YIELDTOPREVYIELD": 0.06,
        "CLOSEYIELD": 0,
        "CLOSEPRICE": null,
        "MARKETPRICETODAY": 90.615,
        "MARKETPRICE": 90.945,
        "LASTTOPREVPRICE": -0.33,
        "NUMTRADES": 7134,
        "VOLTODAY": 2770082,
        "VALTODAY": 2510264982,
        "VALTODAY_USD": 32791503,
        "BOARDID": "TQOB",
        "TRADINGSTATUS": "T",
        "UPDATETIME": "21:54:03",
        "DURATION": 1760,
        "NUMBIDS": null,
        "NUMOFFERS": null,
        "CHANGE": -0.3,
        "TIME": "21:54:01",
        "HIGHBID": null,
        "LOWOFFER": null,
        "PRICEMINUSPREVWAPRICE": -0.335,
        "LASTBID": null,
        "LASTOFFER": null,
        "LCURRENTPRICE": 90.65,
        "LCLOSEPRICE": 90.575,
        "MARKETPRICE2": 90.615,
        "OPENPERIODPRICE": 91.07,
        "SEQNUM": 20260206220904,
        "SYSTIME": "2026-02-06 22:09:04",
        "VALTODAY_RUR": 2510264982,
        "IRICPICLOSE": null,
        "BEICLOSE": null,
        "CBRCLOSE": null,
        "YIELDTOOFFER": null,
        "YIELDLASTCOUPON": null,
        "TRADINGSESSION": "2",
        "CALLOPTIONYIELD": null,
        "CALLOPTIONDURATION": null,
        "ZSPREAD": 0.82,
        "ZSPREADATWAPRICE": 0.8
      },
      {
        "SECID": "SU26253RMFS3",
        "BID": 90.781,
        "BIDDEPTH": null,
        "OFFER": 90.791,
        "OFFERDEPTH": null,
        "SPREAD": 0.01,
        "BIDDEPTHT": 174917,
        "OFFERDEPTHT": 835658,
        "OPEN": 91.175,
        "LOW": 90.699,
        "HIGH": 91.195,
        "LAST": 90.791,
        "LASTCHANGE": 0.009,
        "LASTCHANGEPRCNT": 0.01,
        "QTY": 1,
        "VALUE": 907.91,
        "YIELD": 15.14,
        "VALUE_USD": 11.86,
        "WAPRICE": 90.92,
        "LASTCNGTOLASTWAPRICE": -0.255,
        "WAPTOPREVWAPRICEPRCNT": -0.14,
        "WAPTOPREVWAPRICE": -0.126,
        "YIELDATWAPRICE": 15.11,
        "YIELDTOPREVYIELD": 0.02,
        "CLOSEYIELD": 0,
        "CLOSEPRICE": null,
        "MARKETPRICETODAY": 90.909,
        "MARKETPRICE": 91.052,
        "LASTTOPREVPRICE": -0.3,
        "NUMTRADES": 14623,
        "VOLTODAY": 3203059,
        "VALTODAY": 2911772518,
        "VALTODAY_USD": 38036382,
        "BOARDID": "TQOB",
        "TRADINGSTATUS": "T",
        "UPDATETIME": "21:54:01",
